sentence_id,Max_Label,Negative_cnt,Neutral_cnt,Positive_cnt,Diff_cnt,tweet,claim
251,dif,0,0,0,3,"Well, well, well...
The Walt Disney Company's CEO, Bob Chapek, publicly opposes Florida's controversial ""Don't Say Gay"" bill.

https://www.westernjournal.com/huge-4-disney-employees-arrested-human-trafficking-operation/?utm_source=email&utm_medium=AE&utm_campaign=can&utm_content=2022-03-17",Disney CEO Bob Chapek was arrested for human trafficking.
252,pos,0,0,3,0,"With the money Elon Musk spent to buy Twitter shares, he could have given every American family $2,000,000, a house in Bel Air, 2 Bentleys, lifetime Netflix subscription, and still had enough left over to save all endangered animals and cancel all student and medical debt.","""With the money Elon Musk spent to buy Twitter shares, he could have given every American family $100,000 and still had enough left over to cancel all student debt."""
281,neu,0,3,0,0,So are the rumors true? The FBI lost Hunter Biden's laptop?,The FBI lost Hunter Biden's laptop.
292,pos,0,0,3,0,"AND ALL OF THIS INFORMATION IS ON THE LAPTOP, WITCH THE FBI HAS LOST OR HIDING.
https://trendingpolitics.com",The FBI lost Hunter Biden's laptop.
401,dif,0,0,0,3,"Moral Quandry:
You have bought a loaf of bread at the grocery store and when you go home you realize you received 2 loaves of bread.
What do you do?
--
Addendum: Your delicious lemonade and ice cream were replaced by that bread loaf.","""You go to a store, they don't have bread."""
404,dif,0,0,0,3,Aldi keeps stuffing more and more patio furniture into our local store. They're running out of places to put it. It's not selling. People go there for rock bottom prices on bread and produce. Many don't have an extra $500 for furniture.,"""You go to a store, they don't have bread."""
410,dif,0,0,0,3,Out of bread have to go to the bread store,"""You go to a store, they don't have bread."""
412,dif,0,0,0,5,"Talking about the economy:

""When you go to the store and bread is $1.50....""

Quote from Walter Eisenberg on #MorningJoe

WHO ARE THESE PEOPLE??

Democrats do not have a clue!","""You go to a store, they don't have bread."""
422,dif,0,0,0,3,Nobody in Florida should have to go to the company store and buy bread with Disney Dollars.,"""You go to a store, they don't have bread."""
431,dif,0,0,0,3,"Q: If you have a $10 bill and go to the store for some milk, bread and half of Moscow, how much change will you get?","""You go to a store, they don't have bread."""
433,pos,0,0,3,0,"Alopecia isn't a medical disease; it's an aesthetic one. Nobody is less healthy because they don't have hair, they just don't have hair.","""Alopecia isn't a medical disease; it's an aesthetic one."""
514,neu,0,3,0,0,"I don't know what to make of this news source (as there has been a lot of  fake news out there). What do you think?

https://realrawnews.com/2022/02/putin-vows-to-crush-child-traffickers-in-ukraine/","""Putin Vows to 'Crush' Child Traffickers in Ukraine"""
780,dif,0,0,0,3,"Following the invasion in Ukraine, Biden issued a press release. Biden then spoke to the Ukrainian President, then the leaders of the G7. 

Joe Biden hasn't publicly addressed the American people. 

We need an America First President, not America last. ",Ukraine issued a press release about Joe Biden
802,neg,3,0,0,0,"Biden repeats false claim about trips to Iraq and Afghanistan, this time to graduating midshipmen https://www.foxnews.com/politics/biden-iraq-afghanistan-about-40-times-administration-says-its-half-of-that #FoxNews hiden biden is a joke and can't remember how many times he has been anywhere, let alone middle east !total fraud and the worst ever president","""I've been in and out of Iraq and Afghanistan over 40 times."""
811,neg,3,0,0,0,"They all lie so much, they don't even know the truth.

https://www.foxnews.com/politics/biden-iraq-afghanistan-about-40-times-administration-says-its-half-of-that","""I've been in and out of Iraq and Afghanistan over 40 times."""
821,neg,3,0,0,0,"Hey @WHCOS @VP @PressSec  @DeptofDefense @PentagonPresSec @SECNAV @USNavyCNO, why does @POTUS have such a problem telling the truth? Are honor offenses a thing of the past at @NavalAcademy?
https://www.foxnews.com/politics/biden-iraq-afghanistan-about-40-times-administration-says-its-half-of-that","""I've been in and out of Iraq and Afghanistan over 40 times."""
830,neg,3,0,0,0,Joe and his delusional world. https://www.foxnews.com/politics/biden-iraq-afghanistan-about-40-times-administration-says-its-half-of-that #FoxNews,"""I've been in and out of Iraq and Afghanistan over 40 times."""
841,neu,0,3,0,0,Did Biden really go to Afghanistan/Iraq 40 times?,"""I've been in and out of Iraq and Afghanistan over 40 times."""
863,neg,3,0,0,0,"The 2020 election was not ""stolen"" from Donald Trump. Trump failed to win the election. As a result, Trump lost. His narcissistic ego could not stand the thought that he lost, so, in his diseased mind, he conjured up a delusional story of how the election was ""stolen"" from him.","The 2020 election ""was stolen from Donald J. Trump."""
872,neg,3,1,0,0,Did Donald Trump assert that the 2020 election was stolen while knowing that claim to be false?: https://fb.pollking.com/ @funpollking .....HEY AMERICA....75.4%......SAID......  NO ........,"The 2020 election ""was stolen from Donald J. Trump."""
881,pos,0,1,4,0,"Old News Becomes New News!!!

""'Drop and Roll' - How The 2020 Election Was Stolen From Donald Trump""
The Gateway Pundit Published November 18, 2020

https://rumble.com/vb8ksn-drop-and-roll-how-the-2020-election-was-stolen-from-donald-trump.html","The 2020 election ""was stolen from Donald J. Trump."""
882,neu,0,3,0,0,"Ali Alexander believes the 2020 election was ""stolen"" from Donald #Trump.

Continue reading at https://10ztalk.com/2022/06/29/stop-the-steal-founder-fears-hunter-biden-mitt-romney-will-genocide-us-all-with-star-charts/ | 10z viral","The 2020 election ""was stolen from Donald J. Trump."""
892,neu,0,3,0,0,Watch: Ivanka Rejects Donald Trump's Claims That 2020 Election Was Stolen https://www.msn.com/en-us/news/politics/watch-ivanka-rejects-donald-trump-s-claims-that-2020-election-was-stolen/vi-AAYi1NC?ocid=msedgntp,"The 2020 election ""was stolen from Donald J. Trump."""
901,pos,0,0,3,0,The 2020 election was stolen!! the proof is there!! Donald Trump won!! so let's go Brandon!! is Congress going to investigate me now!!,"The 2020 election ""was stolen from Donald J. Trump."""
942,pos,0,0,3,0,We have doubled our russia imports of oil last year... Maria B.../ h/t @POTUS,"""We have doubled our (oil) imports from Russia in the last year."""
961,pos,0,0,3,0,"Yes, Hillary Clinton spied on Donald Trump -- while he was president  https://www.washingtonexaminer.com/opinion/yes-hillary-clinton-spied-on-donald-trump-while-he-was-president","""Hillary Clinton spied on President Trump."""
962,pos,0,0,3,0,A new filing from Special Counsel John Durham reveals Perkins Coie allies connected to Hillary Clinton's 2016 campaign spied on Trump's internet traffic - WHILE HE WAS PRESIDENT.,"""Hillary Clinton spied on President Trump."""
971,pos,0,0,3,0,The Hillary Clinton campaign spied on President Trump.,"""Hillary Clinton spied on President Trump."""
972,neg,3,0,0,0,"Long, fully detailed piece from @GlennKesslerWP with key data points from @emptywheel. Totally worth your time. 

How the right embraced the false claim that Hillary Clinton 'spied' on Donald Trump https://www.washingtonpost.com/politics/2022/02/18/how-right-embraced-false-claim-clinton-spied-president-trump/","""Hillary Clinton spied on President Trump."""
982,pos,0,0,3,0,"Hillary Clinton actively SPIED on President Trump.

Where is the mainstream media's coverage?#TrumpWasRight","""Hillary Clinton spied on President Trump."""
983,pos,0,0,3,0,"The fact that my Twitter feed comments constantly on how terrible you think Trump was for our country.. it's crazy none of you want to talk about the fact that he, as the President of the United States, was being spied on by Hillary Clinton and her goons.. you all baffle me","""Hillary Clinton spied on President Trump."""
992,pos,0,0,3,0,"EP84: #HillaryClinton Spied on President #Trump, #FreedomConvoy2022, #EpsteinDidntKillHimself, #NYS Lifts #MaskMandates, #Bitcoin Bandits, #SuperBowl #SCAPP 
Hosts; @hannon44 @benhussong https://anchor.fm/scapp/episodes/EP84-Hillary-Clinton-Spied-on-President-Trump--Freedom-Truckers--Epstein-Didnt-Kill-Himself--NYS-Lifts-Mask-Mandate--Bitcoin-Bandits--Super-Bowl-LVI-e1ecukq","""Hillary Clinton spied on President Trump."""
1022,pos,0,0,3,0,"Black-Faced Lefty
/ Authoritarian Justin Trudeau Is Done As New Poll Shows That Only 16% of Canadians Would Support Him After The Way He Dealt With The Trucker Protest
https://www.youtube.com/watch?v=JIEIBgCv0_g&feature=youtu.be","""Only 16% Of Canadians Would SUPPORT Trudeau After Trucker Protest!"""
1101,pos,0,0,3,0,Queen 'health crisis' forces Palace to make 'startling admission' on monarch's future https://www.express.co.uk/news/royal/1635236/queen-news-queen-health-elizabeth-ii-episodic-mobility-issues-royal-family ARTICLE IS TOTAL FAKE NEWS BULLSHIT TO DECEIVE THE PUBLIC WORLD AS SHE IS DEAD S A DOOR NAIL!,Queen Elizabeth II is dead.
1102,dif,0,0,0,3,Something about breath mints - a Kleenex - &amp; the skin of a dead native boy - #QueenElizabeth #QueenElizabethII #Royals #AbolishtheMonarchy Why Queen Elizabeth II Always Carries This Bizarre Item in Her Handbag When She Travels https://www.cheatsheet.com/entertainment/why-queen-elizabeth-ii-always-carries-this-odd-item-in-her-handbag-when-she-travels.html/,Queen Elizabeth II is dead.
1120,pos,0,0,3,0,"Cause she is dead.
@ ""Queen Elizabeth II will not attend Friday's Platinum Jubilee thanksgiving service, Buckingham Palace says "" 
https://twitter.com/i/events/1508384714482065408",Queen Elizabeth II is dead.
1150,neg,3,0,0,0,no way queen elizabeth ii is dead,Queen Elizabeth II is dead.
1181,pos,0,0,3,0,Queen Elizabeth II is dead. That is the truth.,Queen Elizabeth II is dead.
1200,neu,0,3,0,0,"So much to do, so little time.
Is Queen Elizabeth II dead for real?",Queen Elizabeth II is dead.
1212,dif,0,0,0,3,https://www.google.co.uk/imgres?imgurl=https://www.rd.com/wp-content/uploads/2018/07/royal-windsor-horse-show-berkshire-britain-10-may-2013.jpg&imgrefurl=https://www.rd.com/list/queen-elizabeth-ii-funny-photos/&tbnid=98C2cfE3dcjETM&vet=1&docid=nF4zYtgbNJhCvM&w=2400&h=1600&hl=en-GB&source=sh/x/im why hide dead hubby money 99years every one else tax man looks in to NO DEMOCRACY UK NO NEWS PAPERS TORY ASK HER .,Queen Elizabeth II is dead.
1220,pos,0,0,3,0,CNN Confirms Trump WILL be ARRESTED https://www.youtube.com/watch?v=qFu8UQAEvBE&feature=youtu.be via @YouTube,"""CNN confirms Trump WILL be ARRESTED."""
1263,pos,0,0,3,0,"Chilling! Medical professionals~ how would we know?? I was held down as they forced this thing into my brain. No knowledge until it was happening. I don't like talking about it as it's highly personal but maybe it's time 

https://cosmicworld.site/johns-hopkins-university-confirms-you-can-be-vaccinated-with-a-pcr-test-even-without-knowing","""Johns Hopkins University confirms: You can be vaccinated with a PCR test, even without knowing"""
1270,pos,0,0,3,0,"Here's a little something to digest... for your next visit to the MD when you THINK they're only ""swabbing"" (or that's ONLY ""Heparin"" they're ""flushing"" that IV with...)
https://cosmicworld.site/johns-hopkins-university-confirms-you-can-be-vaccinated-with-a-pcr-test-even-without-knowing","""Johns Hopkins University confirms: You can be vaccinated with a PCR test, even without knowing"""
1281,pos,0,0,3,0,"I don't trust the government. I believe this to be true.

https://drleonardcoldwell.com/2021/04/13/johns-hopkins-university-confirms-you-can-be-vaccinated-with-a-pcr-test-even-without-knowing/","""Johns Hopkins University confirms: You can be vaccinated with a PCR test, even without knowing"""
1291,pos,0,0,3,0,"So the PCR test could have vaccinated you?? This is why you should've NEVER trusted these Heads.. We TOLD you they where Lying...
https://cosmicworld.site/johns-hopkins-university-confirms-you-can-be-vaccinated-with-a-pcr-test-even-without-knowing","""Johns Hopkins University confirms: You can be vaccinated with a PCR test, even without knowing"""
1301,pos,0,0,3,0,Boom! Bombshell!  https://cosmicworld.site/johns-hopkins-university-confirms-you-can-be-vaccinated-with-a-pcr-test-even-without-knowing @PrisonPlanet @intellihubnews @maureen_bannon @FoxNews,"""Johns Hopkins University confirms: You can be vaccinated with a PCR test, even without knowing"""
1303,pos,0,0,3,0,These people want a civil war https://www.cosmicworld.site/johns-hopkins-university-confirms-you-can-be-vaccinated-with-a-pcr-test-even-without-knowing,"""Johns Hopkins University confirms: You can be vaccinated with a PCR test, even without knowing"""
1315,neu,0,3,0,0,"Can you be vaccinated without your knowledge during a PCR test? 
https://drleonardcoldwell.com/2021/04/13/johns-hopkins-university-confirms-you-can-be-vaccinated-with-a-pcr-test-even-without-knowing/","""Johns Hopkins University confirms: You can be vaccinated with a PCR test, even without knowing"""
1331,pos,0,0,3,0,"We did our best to warn you - and exactly why DJT refused to use the CDC's or those from WHO in 2020. How did we know and you didn't?

https://drleonardcoldwell.com/2021/04/13/johns-hopkins-university-confirms-you-can-be-vaccinated-with-a-pcr-test-even-without-knowing/","""Johns Hopkins University confirms: You can be vaccinated with a PCR test, even without knowing"""
1360,neu,0,3,0,0,The test is the va xxine? https://www.cosmicworld.site/johns-hopkins-university-confirms-you-can-be-vaccinated-with-a-pcr-test-even-without-knowing,"""Johns Hopkins University confirms: You can be vaccinated with a PCR test, even without knowing"""
1371,pos,0,0,3,0,"Greeeeeeeeeeaaaaaaaaaaaattttttttttttt.
https://www.cosmicworld.site/johns-hopkins-university-confirms-you-can-be-vaccinated-with-a-pcr-test-even-without-knowing","""Johns Hopkins University confirms: You can be vaccinated with a PCR test, even without knowing"""
1372,pos,0,0,3,0,Egad. How do we deal with this?  https://www.cosmicworld.site/johns-hopkins-university-confirms-you-can-be-vaccinated-with-a-pcr-test-even-without-knowing,"""Johns Hopkins University confirms: You can be vaccinated with a PCR test, even without knowing"""
1392,pos,0,0,3,0,"Never had a PCR test? Be grateful. 
Check this out. 

https://drleonardcoldwell.com/2021/04/13/johns-hopkins-university-confirms-you-can-be-vaccinated-with-a-pcr-test-even-without-knowing/","""Johns Hopkins University confirms: You can be vaccinated with a PCR test, even without knowing"""
1401,pos,0,0,3,0," ""new technology developed at Johns Hopkins University that is supposed to make it possible to carry out covert vaccinations through a PCR test.""!!
Article dated April 13, 2021. Dr. Leonard Coldwell
https://drleonardcoldwell.com/2021/04/13/johns-hopkins-university-confirms-you-can-be-vaccinated-with-a-pcr-test-even-without-knowing/","""Johns Hopkins University confirms: You can be vaccinated with a PCR test, even without knowing"""
1410,pos,0,0,3,0,This is troubling! I always distrusted those damn PCR tests! Nasopharyngeal rape! #PCRTest #PCR #consent #NoConsent #autonomy #corporalAutonomy https://drleonardcoldwell.com/2021/04/13/johns-hopkins-university-confirms-you-can-be-vaccinated-with-a-pcr-test-even-without-knowing/,"""Johns Hopkins University confirms: You can be vaccinated with a PCR test, even without knowing"""
1442,pos,0,0,3,0,"https://www.foreignaffairs.com/articles/china/2022-05-17/collateral-damage-chinas-covid-war?utm_medium=newsletters&utm_source=fatoday&utm_campaign=The%20Collateral%20Damage%20in%20China%E2%80%99s%20Covid%20War%20&utm_content=20220517&utm_term=FA%20Today%20-%20112017
Look at it from my angle: They know what they've created and so, they know what they're up against.","""We all know China created COVID."""
1472,pos,0,0,3,0,".
.
.
Biden has $30 million for crack pipes  ... 
.
Free community college 'no longer part' of Dem spending plan, Jill Biden says | KTLA https://thehill.com/homenews/administration/593082-jill-biden-free-community-college-wont-be-in-spending-bill/","The Biden administration ""is spending $30 million on crack pipes."""
1500,dif,0,0,0,3,"The IRS has admitted that tax refunds can take some time because of delays, especially due to the COVID-19 stimulus checks and child tax credits given out in 2020 and 2021. | By @HerbScribner

https://www.deseret.com/2022/2/10/22927359/tax-refunds-2022-how-to-get-tax-return-quick?utm_source=twitter&utm_medium=dn-social&utm_campaign=twitter&utm_content=deseretnews","$2,000 stimulus checks were due on Jan. 19."
1511,neg,3,0,0,0,Donald Trump left the White House in January 2021 and is still using the presidential seal at his New Jersey golf club https://www.msn.com/en-us/news/politics/donald-trump-left-the-white-house-in-january-2021-and-is-still-using-the-presidential-seal-at-his-new-jersey-golf-club/ar-AA106Jiv?ocid=mailsignout&pc=U591&cvid=4412cd9d7be449e48782568a72661d0f ISNT THIS AGAINST THE LAW TO IMPERSONATE A POTUS ?? WHY DONT THEY JAIL THE FAT BASTARD,"Donald Trump ""never left"" the White House."
1521,dif,1,0,0,3,Several House Republicans Allegedly Asked Trump for a Pardon | https://people.com/ https://people.com/politics/several-house-republicans-allegedly-asked-donald-trump-for-a-pardon-before-he-left-the-white-house/,"Donald Trump ""never left"" the White House."
1531,dif,0,0,0,3,"New Stories at http://rightwingmedia.net/
--""Donald Trump: The World is Going to Be Blown Up""
--""The Missiles of October"" Promo
--White House Correspondent's Dinner
--Russia Sends Chilling Threat
--Elon Musk Slams Far Left","Donald Trump ""never left"" the White House."
1551,neg,3,1,0,0,Donald Trump took classified information with him when he left the White House when does it become criminal when will he go to jail...??????,"Donald Trump ""never left"" the White House."
1622,pos,0,0,3,0,"Freedom of Information request revealing that the number of deaths in England and Wales attributable exclusively to COVID-19 is far lower than reported death rates would suggest
https://www.patrioticviralnews.com/articles/total-deaths-from-covid-19-much-lower-than-reported/","""Total deaths from COVID MUCH LOWER than reported."""
1671,pos,0,0,3,0,"ROMNEY: ""People are 7 percent poorer now because of Biden inflation. Gasoline prices are, what, 50 percent higher than they were when he took office. The border is a mess. COVID was resurgent, but he didn't have a place for the tests people needed.

Even this FRAUD knows.....","""People are 7% poorer now because of Biden inflation."""
1683,neu,0,3,0,0,"DirecTV Cancels OAN after Joe Biden Orders Media Outlets and Tech Giants to Banish Voices that Deviate from the Regime's Official Narrative
By Jim Hoft
Published January 14, 2022
https://www.thegatewaypundit.com/2022/01/directv-cancels-oan-joe-biden-orders-media-outlets-tech-giants-banish-voices-deviate-regimes-official-narrative/ https://gettr.com/post/pphc9a7e24","""DirecTV cancels OAN after Joe Biden orders media outlets and tech giants to banish voices that deviate from the regime's official narrative."""
1773,neu,0,3,0,0,"Biden uses Trump's name - in contrast to his Jan 6 speech - as he attacks GOP on voting rights
'So they're making it harder for you to vote by mail ... the same way I might add in the 2020 election President Trump voted from behind the desk in the White House in Florida...'","""In the 2020 election, President Trump voted from behind the desk in the White House in Florida."""
1790,pos,0,0,3,0,"Are you AWAKE yet?
HOLD THE LINE!!! 
https://www.australiannationalreview.com/health/japan-drops-all-vaxxine-mandates-places-myocarditis-warning-on-label/","""Japan drops all vaxxine mandates, places myocarditis warning on label."""
1791,pos,0,0,3,0,"In Japan, this is over.

The Narrative has already collapsed.

 https://www.australiannationalreview.com/health/japan-drops-all-vaxxine-mandates-places-myocarditis-warning-on-label/","""Japan drops all vaxxine mandates, places myocarditis warning on label."""
1802,pos,0,0,3,0,Japan drops all mandates and puts warning label on v4ccines! https://www.australiannationalreview.com/health/japan-drops-all-vaxxine-mandates-places-myocarditis-warning-on-label/,"""Japan drops all vaxxine mandates, places myocarditis warning on label."""
1811,pos,0,0,3,0,"Well it looks Japan has a lot to teach o the rest of the world against coercion and in favour of body autonomy 

https://www.australiannationalreview.com/health/japan-drops-all-vaxxine-mandates-places-myocarditis-warning-on-label/","""Japan drops all vaxxine mandates, places myocarditis warning on label."""
1812,pos,0,0,3,0,Good job #Japan  https://www.australiannationalreview.com/health/japan-drops-all-vaxxine-mandates-places-myocarditis-warning-on-label/,"""Japan drops all vaxxine mandates, places myocarditis warning on label."""
1813,pos,0,0,3,0,"https://www.australiannationalreview.com/health/japan-drops-all-vaxxine-mandates-places-myocarditis-warning-on-label/

Japan first to recognise the Science....","""Japan drops all vaxxine mandates, places myocarditis warning on label."""
1820,pos,0,0,3,0,"Japan turning away from vaccines due to high risk of myocarditis
https://www.australiannationalreview.com/","""Japan drops all vaxxine mandates, places myocarditis warning on label."""
1822,pos,0,0,3,0,"Japan actually cares about its people!!
https://www.australiannationalreview.com/health/japan-drops-all-vaxxine-mandates-places-myocarditis-warning-on-label/?fbclid=IwAR1iGOFb6m4KoJZdHAewnudBbskLJv0z-sw0i1xy8v0HemwAGVgHZ8l3l0Q","""Japan drops all vaxxine mandates, places myocarditis warning on label."""
1836,pos,0,0,3,0,New Zealand okays euthanasia for COVID patients - Catholic Herald https://catholicherald.co.uk/new-zealand-okays-euthanasia-for-covid-patients/,"""New Zealand okays euthanasia for COVID patients."""
1980,pos,0,0,3,0,"Data from around the world suggests that omicron favors the fully vaccinated https://alphanews.org/data-show-omicron-more-resistant-to-vaccines-than-delta-variant/ 
#omicron or #moronic you choose","""Data from around the world suggests that omicron favors the fully vaccinated."""
2020,dif,0,0,0,3,"While the IRS is still heavily backlogged due to the pandemic, it seems those who filed their taxes early haven't had to wait very long for their refunds.
https://local12.com/news/nation-world/heres-how-much-americans-have-gotten-back-on-average-from-this-years-irs-tax-refunds-returns-file-filing-backlog-child-tax-credit-season-dependent-claim-money-american-rescue-plan-president-joe-biden-stimulus-pandemic-covid-19-coronavirus-cincinnati-ohio","President Joe Biden ""never had a"" COVID-19 ""plan."""
2061,dif,0,0,0,5,"So the numbers are in from last night's first installment of the insurrection follies. (Source: TVLine .com)
.
ABC -- 4.9 million viewers
NBC -- 3.6 million
CBS -- 3.4 million
MSNBC -- 4.2 million
CNN -- 2.6 million
Fox News (which boycotted the hearing) -- 3 million.
No flop.","""Jan. 6 was NOT an insurrection...but Nov. 4 at 3 a.m. was!"""
2091,dif,0,0,0,4,"WTH?! news(via Kos)
1)Here we go again?https://www.dailykos.com/stories/2022/2/14/2080332/-Manchin-dangles-a-new-path-on-Biden-s-BBB-priorities-one-Sinema-has-already-nixed
2)https://www.dailykos.com/stories/2022/2/14/2077511/-Terrifying-ad-of-Florida-s-future-after-Don-t-Say-Gay-makes-me-wonder-where-the-f-ing-outrage-is 
3)https://www.dailykos.com/stories/2022/2/14/2080387/-Rubio-does-SPECTACULAR-Flip-Flop-on-safeguarding-government-documents-when-Trump-steals-them
4)https://www.dailykos.com/stories/2022/2/14/1478721/-QAnon-racist-traitor-knew-the-disease-was-deadly-and-still-refused-to-protect-himself-because-farts
6)https://www.dailykos.com/stories/2022/2/14/2080290/-Criminal-defense-attorney-charged-for-his-role-in-Jan-6-insurrection-still-practicing-in-Georgia
7)https://www.dailykos.com/stories/2022/2/14/2080175/-Chinless-wonder-Lindsey-Graham-calls-Trump-dominant
8)https://www.dailykos.com/stories/2022/2/15/1478325/-Republican-precinct-captain-in-Texas-claims-Biden-and-hospital-murdered-her-father-It-was-COVID","""Jan. 6 was NOT an insurrection...but Nov. 4 at 3 a.m. was!"""
2103,pos,0,0,3,0,"January 6 was not an ""insurrection,"" but Nov 3/4 was a coup","""Jan. 6 was NOT an insurrection...but Nov. 4 at 3 a.m. was!"""
2111,neu,0,3,0,0,"Let's name words that we never heard before tRump's January 6th Capitol riot.

1 - Insurrection 
2 - Seditionist 
3 - ?
4 - ?
5 - ?
6 - ?
7 - ?","""Jan. 6 was NOT an insurrection...but Nov. 4 at 3 a.m. was!"""
2191,pos,0,0,3,0,"The Fauci-ouchi has his grubby  little hands all over the patents belonging to various manufacturers...including those with nano microchips 
https://rumble.com/vq6e3h-moderna-patent-uncovers-horror-nanocensor-contained-in-bioweapon.html?mref=6zof&mc=dgip3&utm_source=newsletter&utm_medium=email&utm_campaign=Stew+Peters+Show&ep=2","""Moderna patent uncovers horror nanocensor contained in bioweapon."""
2231,neu,0,3,0,0,4.21.22 ... Politifact claims this is not a credible story. Who knows? https://thegloriousamerican.com/u-s-news/california-store-owner-prices-all-items-at-951-so-thieves-can-be-prosecuted-8-4-22/,"""California store owner prices all items at $951 so thieves can be prosecuted."""
2261,pos,0,0,3,0,"'A new study published on Researchgate provides further proof that the Covid-19 injections cause recipients to develop crippling Acquired Immunodeficiency Syndrome'  (AKA 'AIDS')
https://rightsfreedoms.wordpress.com/2022/06/24/new-study-provides-more-evidence-the-covid-19-vaccines-cause-acquired-immune-deficiency-syndrome/",The COVID-19 vaccines cause AIDS.
