sentence_id,Max_Label,Negative_cnt,Neutral_cnt,Positive_cnt,Diff_cnt,tweet,claim
4491,pos,0,0,3,0,"Biden Orders VA To Withhold Health Benefits From Unvaccinated Veterans https://www.delawareohionews.com/national-news/biden-orders-va-to-withhold-health-benefits-from-unvaccinated-veterans/ via @DelawareOhNews

I am a disabled veteran and I will not be forced to get any #deathjabs. 

#IMPEACHBIDENNOW","""Biden orders VA to withhold benefits from unvaccinated veterans."""
4680,pos,0,0,3,0,What a troll... https://newspunch.com/president-putin-bans-mandatory-vaccinations-in-russia-we-are-a-free-country/,"""President Putin bans mandatory vaccinations in Russia."""
4681,pos,0,1,3,0,"ANTI-VAXXERS:

FREEDOM (!!!!) IS INVITING YOU TO RUSSIA. 

@RBReich @franifio #antivaxxers #antivax @lednabm 

https://newspunch.com/president-putin-bans-mandatory-vaccinations-in-russia-we-are-a-free-country/","""President Putin bans mandatory vaccinations in Russia."""
4811,neu,0,3,0,0,"https://www.maravipost.com/shocking-bill-gates-calls-for-the-withdrawal-of-all-covid-19-vaccines-the-vaccines-are-far-more-dangerous-than-anyone-imagined/
Hello sir, I just want to know, is the statement in the article is given by you???!!! @BillGates","""Bill Gates calls for the withdrawal of all Covid-19 Vaccines; 'The vaccines are far more dangerous than anyone imagined.'"""
4832,pos,0,0,3,0,Shocking Video Shows Taliban Hanging Man From US Black Hawk Helicopter O... https://www.youtube.com/watch?v=g314C0vXg2g&feature=youtu.be via @YouTube,"A video shows the ""Taliban hanging someone from a helicopter."""
4871,pos,0,0,3,0,"1/4 Samsung Biologics is building a fifth plant for novel treatment types, including cell and gene therapy and mRNA and DNA vaccines! $MRNA $GSK $PFE #COVID19 #mRNA #CDMO #Samsung 
https://bit.ly/3ga7u0N","The mRNA COVID-19 vaccines are ""really gene therapy."""
4890,dif,0,0,0,3,Ed Silverman: STAT+: Pharmalittle: Pfizer says 'trust us' when it comes to a Covid-19 booster; FDA OKs extra dose of the mRNA shots for some people https://www.statnews.com/pharmalot/2021/08/13/pfizer-covid19-pandemic-vaccines-gene-therapy-sleep/?utm_campaign=rss,"The mRNA COVID-19 vaccines are ""really gene therapy."""
4891,dif,0,0,0,3,Pharmalot.. Pharmalittle.. Good Morning: Pfizer says 'trust us' when it comes to a Covid-19 booster; FDA OKs extra dose of the mRNA shots for some people &amp; More news.. https://www.statnews.com/pharmalot/2021/08/13/pfizer-covid19-pandemic-vaccines-gene-therapy-sleep/ #pharma #Covid19 #pandemic #vaccine #opioids $PFE $JNJ $MRNA $BNTX $PM $JAZZ $BIIB $LLY,"The mRNA COVID-19 vaccines are ""really gene therapy."""
4923,dif,0,0,0,3,I had NOTHING to do with the development of the MRNA vaccine but Albert Bourla wants to blame me b/c it does not work https://www.businessinsider.com/pfizer-ceo-constant-waves-covid-19-coronavirus-complacency-albert-bourla-2022-5,"""Pfizer CEO has not yet had vaccine."""
4930,dif,0,0,0,4,"Ok, so traditional vaccines only had one dose. Anything fishy going on?
@EpochTimes  #vaccine 
https://www.theepochtimes.com/pfizer-ceo-fourth-covid-19-vaccine-dose-neccessary_4334523.html?utm_source=morningbriefnoe&utm_campaign=mb-2022-03-14&utm_medium=email&est=UNQS4l7N3TlPJquwwIViSBT1cDD6fw3TokCPttVt67G6axRpvH4%2F7xj3piU3Tx3SGA%3D%3D","""Pfizer CEO has not yet had vaccine."""
4941,dif,0,0,0,3,Just in time for everyone to have had it. https://thehill.com/policy/healthcare/588988-pfizer-ceo-predicts-omicron-vaccine-will-be-ready-in-march/,"""Pfizer CEO has not yet had vaccine."""
5082,dif,0,0,0,3,"99% chance I have covid, I'm dying and all I want is ben n Jerry's, donuts, chocolate, and maybe some in n out","There is a ""0.05% chance of dying from COVID."""
5191,neg,3,0,0,0,"Fox ""News"" lies to its audience. Fox ""news"" kills its audience. All to create a sense of chaos the GOP thinks it can use to take back total power. https://www.mediamatters.org/fox-news/10-fox-figures-who-recklessly-promoted-ivermectin-effective-covid-19-treatment",Ivermectin is an effective treatment for COVID-19.
5202,neg,3,0,0,0,"The drug is not approved for treatment of COVID-19 in Japan, &amp;the U.S. FDA, WHO, EU drug regulator &amp; Merck (MRK.N), which makes the drug, have warned against its use bc of a lack of scientific evidence that it has therapeutic effect.

https://www.reuters.com/business/healthcare-pharmaceuticals/japans-kowa-says-ivermectin-effective-against-omicron-phase-iii-trial-2022-01-31/",Ivermectin is an effective treatment for COVID-19.
5212,neg,3,0,0,0,"Merck &amp; Co.'s COVID-19 pill molnupiravir must first overcome misinformation
Unproven claims on social media that ivermectin is effective against COVID-19 could lower demand for Merck &amp; Co.'s molnupiravir, a COVID-19 treatment the company hopes will soon b...https://www.linkedin.com/feed/update/urn:li:share:6876177689246474240",Ivermectin is an effective treatment for COVID-19.
5242,neg,3,0,0,0,"No, you should not take horse dewormer. Wear a damn mask and get the damn shot.
https://www.dailykos.com/stories/2021/9/3/2050134/-Ivermectin-is-NOT-a-highly-effective-treatment-for-COVID-19",Ivermectin is an effective treatment for COVID-19.
5370,pos,0,0,3,0,"CDC Hiding the number of vaccine deaths!
https://www.thegatewaypundit.com/2021/07/cdc-quietly-deletes-6000-covid-vaccine-deaths-cdc-website-total-one-day-caught-internet-sleuths-video/?ff_source=Twitter&ff_campaign=websitesharingbuttons","""CDC quietly deletes 6,000 COVID vaccine deaths from its CDC website total in one day."""
5401,dif,0,0,0,4,"Right I'm NOT going to get drawn into a big debate about what I'm about to say!. It is NOT Vegan to have Vaccinations, im not an ''Anti Vaxxer'' conspiracy theory type. But a passionate Anti Vivisection campaigner!. https://nypost.com/2021/06/08/vegans-are-less-likely-to-get-severe-covid-study-says/","""You're not going to get COVID if you have these vaccinations."""
5411,neu,0,3,0,0,"""You're not going to get COVID if you have these vaccinations,"".                                - Joe Biden (July 2021)","""You're not going to get COVID if you have these vaccinations."""
5661,neu,0,3,0,0,A few of those who lost federal benefits are able to reclaim state benefits. So dig more into continuing claims to see the impact of the end of the federal UI bonus. #kbrs https://realeconomy.rsmus.com/initial-jobless-claims-rose-for-third-straight-as-millions-lost-federal-pandemic-benefits/,"""Before the pandemic, just over 40,000 were on continuing UI claims. Now, there are well over 100,000 on state or federal UI benefits."""
5722,dif,0,0,0,4,#ZABhutto was judicially murdered. #IK's govt judicial murder took place by the conspiracy of its legal team in the SC by not producing the letter. U tube video by  Abid Andleeb is eye opener. #IK &amp; his Cabinet must watch it now  lest it becomes too late to react. @IK  @Urgent,"""There is a place in the U.S. where murder is legal."""
5732,dif,0,0,0,3,"So last week K'von Wallace is called for a flag on a legal play and this week an attempted murder takes place, and nothing.","""There is a place in the U.S. where murder is legal."""
5760,pos,0,0,3,0,"U.S. Military Arrests Dr. Deborah Birx
Restored Republic
May 29, 2021
https://rumble.com/vhsp4l-u.s.-military-arrests-dr.-deborah-birx.html","""U.S. military arrests Dr. Deborah Birx."""
5821,dif,0,0,0,3,Dominion lawyer says the voting technology company is 'still exploring' whether to sue Trump over election lies https://www.businessinsider.com/dominion-may-still-sue-donald-trump-election-lies-2021-8?utmSource=twitter&utmContent=referral&utmTerm=topbar&referrer=twitter via @businessinsider,Says Donald Trump was back on Twitter as of May 2021.
5863,pos,0,0,3,0,"*Gas prices highest in a decade.
*Worst jobs report in 2 decades.
*Highest inflation in 3 decades.
*Highest increase in illegal immigration in 4 decades.  

Got to love the emotional voting skills...","""Gas prices highest in a decade. Worst jobs report in 2 decades. Highest inflation in 3 decades. Highest increase in illegal immigration in 4 decades."""
5962,pos,0,0,3,0,"#BlackLivesMatter  says it stands with #HamasTerrorists   in #Israeli  conflict
http://www.islamedianalysis.info/black-lives-matter-says-it-stands-with-hamas-terrorists-in-israeli-conflict/","""Black Lives Matter says it stands with Hamas terrorists in Israeli conflict."""
6160,pos,0,0,3,0,"U.S. census bureau CONFIRMS huge conflict in total number of voters in the 2020. This time the data reported by census bureau conflicts with the election results. They said, their are obvious discrepancies with the results.","""U.S. Census Bureau confirms huge conflict in total number of voters in 2020 election."""
6191,dif,0,0,0,3,"New Jersey's largest city unanimously passed a resolution Wednesday to suspend the business license of local Lukoil gas stations -- an action prompted by Russia's invasion of Ukraine last week.
https://www.nbcnewyork.com/news/local/newark-council-suspends-franchise-owned-lukoil-gas-stations-licenses-due-to-russian-invasion/3580026/?_osource=SocialFlowFB_NYBrand","New Jersey ""will be out of gas for a week."""
6202,dif,0,0,0,3,Top News Of The Week In Scotch Plains-Fanwood: 3 Winners In Juneteenth Student Design Contest; Erratic Driver Wanted After Police Chase. https://patch.com/new-jersey/scotchplains,"New Jersey ""will be out of gas for a week."""
6260,pos,0,0,3,0,"DAVID LESTER STRAIGHT SERVES ON SEVERAL (TRUMP) PRESIDENTIAL TASK FORCES Inc HUMAN TRAFFICKING AND JUDICIAL CORRUPTION SAYS HILLARY CLINTON WAS TRIED, CONVICTED, AND WAS EXECUTED ON APRIL 26, 2021

CONFIRMS what REAL RAW NEWS said!
https://realrawnews.com/2021/04/hillary-clinton-hanged-at-gitmo/
https://www.bitchute.com/video/Tp9c3zuse8UE/","""Hillary Clinton hanged at GITMO."""
6320,neu,0,3,0,0,It's my third day with moldavite and I'm hearing that Hillary Clinton was hanged at Gitmo??,"""Hillary Clinton hanged at GITMO."""
6381,pos,0,0,3,0,"Mario SaPut0
@MJackshiite
 
A Quarter of a MILLION ILLEGAL Votes found in ARIZONA'S AUDIT...so far!","""A quarter of a million illegal votes found in Arizona's audit."""
6454,neu,0,3,0,0,".@GovAbbott credited ""simple math"" with the success in the nation's second-most populous state.
https://cbs4local.com/news/nation-world/texas-gov-declares-state-close-to-herd-immunity-what-do-the-numbers-say","Texas ""could be very close to herd immunity."""
6462,neg,3,0,0,0,"No, @GregAbbott_TX, 29% is NOT ""very close"" to the minimum of 70% that might be considered herd immunity. You are lying to Texans - again. #TxLege #COVID #Vaccine #GregAbbottLies   https://www.kvue.com/article/news/verify/texas-herd-immunity-covid-coronavirus-governor-greg-abbott/269-102ba761-2aa9-401c-8a2c-df00614eeb22","Texas ""could be very close to herd immunity."""
6470,neg,3,0,0,0,Such a #COVIDIDIOT! @GovAbbott's claim that Texas is very close to herd immunity is not even close https://news.yahoo.com/gov-greg-abbotts-claim-texas-124005959.html?soc_src=community&soc_trk=tw via @YahooNews,"Texas ""could be very close to herd immunity."""
6503,pos,0,0,3,0,To the seditious traitor: Keep telling your supporters the Covid-19 vaccines work https://www.vox.com/science-and-health/2021/3/18/22338032/trump-covid-19-vaccine-hesitancy-republicans?utm_campaign=vox&utm_content=entry&utm_medium=social&utm_source=twitter via @voxdotcom,"""Maybe (the COVID-19 vaccine) doesn't work, and they're simply not telling you that."""
6554,pos,0,0,3,0,Bombshell: Moderna Chief Medical Officer Admits mRNA Alters DNA - The Washington Standard. Here to all you ppl that received your jabs read this ! https://thewashingtonstandard.com/bombshell-moderna-chief-medical-officer-admits-mrna-alters-dna/,"""Moderna chief medical officer admits: mRNA alters DNA."""
6752,neg,3,1,0,0,"When joe biden really said ""but you go to a gun show you buy whatever you want no background check"" lmao ","""You go to a gun show, you can buy whatever you want, and no background check."""
6842,pos,0,0,3,0,"First it was that 94% of Covid deaths, 'Covid isn't the primary reason for death. Now the injections being given are killing just as many people.https://www.thegatewaypundit.com/2021/03/exclusive-per-cdc-data-nearly-twice-many-vaccine-related-deaths-far-2021-1755-vaccine-deaths-past-decade-994/?fbclid=IwAR2U8vRAxKMbJbSL8VXIQBPcHSXPQ7e1LurF5fLyVTo9JjF1COwohoxFLsg","""Per the CDC, there are nearly twice as many vaccine-related deaths so far in 2021 (1,755) than all the vaccine deaths this past decade (994)."""
6862,neg,3,0,0,0,"#ELB: @PolitiFact Rates as ""Mostly False"" Statement That Michigan election bills are ""designed to make it easier for people to vote."" https://electionlawblog.org/?p=121466","Michigan election bills are ""designed to make it easier for people to vote."""
7080,neg,3,0,0,0,"Oh FFS.  The comments at the bottom show just how delusional these nimrods are.  They believe this BS and even more ridiculous BS

https://realrawnews.com/2021/03/navy-seals-arrest-hillary-clinton/?fbclid=IwAR0UfHA-EyoZHQNUIjYuxNPrNrcqvfpb6yF4_Wolr-BCkspXzZWhQicZodw","""Navy SEALs arrest Hillary Clinton."""
7210,pos,0,0,3,0,"The Republicans are lieing to us ..
Claim: ""Marco Rubio's 'red flag' gun confiscation bill"" calls for guns to be confiscated ""without due process, based on unsubstantiated accusations.""

Claimed by: National Association for Gun Rights:
it's TRUE and it will.","""Marco Rubio's 'red flag' gun confiscation bill"" calls for guns to be confiscated ""without due process, based on unsubstantiated accusations."""
7233,dif,0,1,0,4,"This week marks 1 year since @POTUS took office. With the American Rescue Plan, @HouseDemocrats delivered on our promise to #BuildBackBetter to: 
 Put vaccines in arms
 Money in peoples' pockets
 Helped kids return to safer schools.","In the American Rescue Plan, ""just about 1% of the money is for vaccines."""
7252,neu,0,3,0,0,"Crude oil prices are expected to keep rising and could reach as high as $100 a barrel by later this year. Plus, higher oil prices could result in higher prices at the pump this Fourth of July weekend. Read more of last week's top energy stories.  
https://consumerenergyalliance.org/2021/06/ceas-top-5-favorite-energy-stories-this-week-june-25/","""Oil is now $61.30 a barrel and rising drastically! On Jan. 5, it was about $25 a barrel."""
7312,neu,0,3,1,0,"Sen. Ron Johnson says riot at the Capitol on Jan 6, 2021 ""didn't seem like an armed insurrection to me."" FBI counterterrorism official was asked ""How many shots were fired?"" Answer: ""I'm only aware of one."" The one by Capitol police who shot Ashli Babbitt https://www.newsmax.com/politics/ron-johnson-capitol-riot-interview-firearms/2021/02/16/id/1010205/","Says Jan. 6 Capitol riot ""didn't seem like an armed insurrection."""
7521,pos,0,0,4,0,"Trump Assassination Foiled, Deep State in Panic Mode!

On Tuesday morning, January 26, at approximately 3:00 am, a sniper's bullet struck a panoramic casement window on the east wall of Trump's bedroom at his Mar-a-Lago estate. The round might have slain Trump had he not [1]","""Trump assassination foiled, Deep State in panic mode!"""
7540,pos,0,0,3,0,Why has the White House been dark for 10 or is it 11 nights in a row? WTH,The White House was dark for 10 nights in a row.
7551,pos,0,0,3,0,"Donald Trump is the first President in modern history did not start a new war.

RT if you agree with me.","""Donald Trump is the first president in modern history (who) did not start a new war."""
7560,neg,3,0,0,0,"First Draft Provides Hub To Counter Vaccine Misinformation: It calls out Turning Point Action cofounder Ryan Fournier for tweeting ""the Biden Administration lost 20 million COVID vaccines..."" when... https://www.mediapost.com/publications/article/360230/first-draft-provides-hub-to-counter-vaccine-misinf.html","""The Biden administration lost 20 million COVID vaccines."""
7592,dif,0,0,0,3,"They saying Busta Rhymes got Halitosis, that's why they need him to wear a mask","""WHO now saying you do not need to wear a mask."""
7602,dif,0,0,0,3,"just saying even once i get my vaccine im still gonna wear a mask
don't need ppl thinking im conservative ","""WHO now saying you do not need to wear a mask."""
7611,dif,0,0,0,3,"So Rand Paul is now saying that, because he wouldn't wear a mask &amp; caught covid, he doesn't need to get vaccinated because he got covid. 

let's diagram that logic:

no mask ---&gt; caught covid ---&gt; won't get vaccinated. 

got it.","""WHO now saying you do not need to wear a mask."""
7622,dif,0,0,0,3,"Gujju Girl saying tht plss plss plss plsssss TC of ur health  @Siva_Kartikeyan thalaivaawear mask  always n pls avoid crowd 
I just want u all to b safe there
GG missing u sooo sooo badly yarrr sending my luv
u n fam pls TC okayy don't need anything else","""WHO now saying you do not need to wear a mask."""
7662,pos,0,0,3,0,WHO now says:  No Masks needed https://rainbowwarrior2005.wordpress.com/2021/01/26/who-now-saying-you-do-not-need-to-wear-a-mask/?fbclid=IwAR1WXFi4N0aAL-HQsAnP8--Uv8Q0GBshrJXbnK9I9K4dsKFCg1c1ZEy8F5Y,"""WHO now saying you do not need to wear a mask."""
7762,dif,0,0,0,3,"Biden fumes over Cuomo's DNC speech, book claims ""Every four years, Democrats asked themselves the same question about the NY Gov: 'How is Andrew Cuomo going to f- -k us this time?'' write the authors of ""Lucky: How Joe Biden Barely Won the Presidency.'' https://nypost.com/2021/03/02/book-says-biden-camp-fumed-over-cuomos-dnc-speech/","Says Joe Biden and Democrats ""have not legitimately won"" the presidency."
7781,neu,0,3,0,0,"What is this now??
https://arlinreport.com/2021/01/16/insurrection-act-signed-by-trump-jan-14-2021-inauguration-cancelled-trump-remains-in-office-abc-nbc-cbs-fox-cnn-msnbc-to-lose-licenses-truth11-com/","""Inauguration Cancelled, Trump Remains in Office."""
7842,neg,3,0,0,0,"There are people who believe that :#TrumpRemainsinOffice.

I had to read this piece 3 times.

#Cult45 

https://beforeitsnews.com/politics/2021/01/inauguration-cancelled-trump-remains-in-office-abc-nbc-cbs-fox-cnn-msnbc-to-loose-licenses-3223234.html?fbclid=IwAR2g1vNnIYJm10wlA2tkWENzuJr4q_QV9p0Q0IQrdJHZmzFvbEu9DMnfck4","""Inauguration Cancelled, Trump Remains in Office."""
8112,neg,3,0,0,0,"""I won Georgia by hundreds of thousands of votes!"" LMBO!!!!  NO YOU DIDNT!!!! 

Y'all go get your president - he's senile.","""We won Georgia easily. We won it by hundreds of thousands of votes."""
8261,pos,0,0,3,0,"No #candidate has ever won both #Florida and #Ohio and lost. All of my #lawyers and everyone in my #Administration will continue to invent the most tremendous #lies, #deceptions, and #untruths that I #won them both, by a lot, until I am declared #President For Life! #SupremeCourt","""No candidate has ever won both Florida and Ohio and lost."""
8271,neu,0,3,0,0,"@LivioOliveira e outros 38 curtiram

Donald J. Trump @realDonaldTrump

. 5 h
No candidate has ever won both Florida and Ohio and lost. I won them both, by a lot! #SupremeCourt","""No candidate has ever won both Florida and Ohio and lost."""
8272,neg,3,0,0,0,"Trump thinks that no candidate has ever won Florida and Ohio and lost the presidency, but two have.

However, no candidate has ever won CA, OR, WA, HI, NV, AZ, NM, CO, MN, WI, IL, MI, GA, VA, PA, NY, ME, VT, NH, MA, RI, CT, NJ, DE, MD, and DC and lost the presidency.","""No candidate has ever won both Florida and Ohio and lost."""
8442,neg,3,0,0,0,"Chesterfield's general registrar has provided polling data from recent presidential elections that contradicts state Sen. Amanda Chase's claim that the county's Southside voting precinct is ""infamous for having over 100% of the [registered] vote count.""
https://www.chesterfieldobserver.com/articles/registrar-debunks-sen-chases-claims-of-voting-irregularities/","""In Chesterfield (Va.), the Southside precinct is infamous for having over 100% of the vote count..."""
8451,pos,0,0,3,0,"It's National Lead Poisoning Prevention Week. I'm so glad we have a Governor who cares and wants to help WI cities get to 0% lead piping.

Sadly, in 2019, Republicans stripped $40 million from the budget for lead pipe replacement - because they thought it helped MKE too much.","""In 2019, Republicans stripped $40 million from the budget for lead pipe replacement - because they thought it helped MKE too much."""
8490,neu,0,3,0,0,"Any of my Dane Co/Madison/smart friends have any idea what this is all about? I mean, yeah, it's Jim Hoft. But still. https://www.thegatewaypundit.com/2020/11/breaking-exclusive-thousands-fake-votes-found-wisconsin-recount-dane-county-photos-report-gop-observer/?fbclid=IwAR1Na7mz6SG79Nh0HkSqBqkfJDaItZT9Sx7QNztM9lCt3UdclQmv1cA3zL0","""THOUSANDS of fake votes found at Wisconsin Recount in Dane County."""
8521,neu,0,3,0,0,"""We've identified,"" she added, ""at least 450,000 ballots in the key states that miraculously only have a mark for Joe Biden on them and no other candidate."" https://www.breitbart.com/politics/2020/11/16/sidney-powell-lin-wood-promise-theres-ton-voter-fraud/","""At least 450,000 ballots in the key states ... miraculously only have a mark for Joe Biden on them, and no other candidate."""
8543,pos,0,0,3,0,"Wow! Michigan just refused to certify the election results! Having courage is a beautiful thing. The USA stands proud!
Just landed in Traverse City, Michigan. Big crowd!","""Michigan just refused to certify the election results!"""
8791,pos,0,0,3,0,https://buffalochronicle.com/2020/11/07/mitt-romney-has-been-asked-to-lead-health-and-human-services-in-biden-administration/?fbclid=IwAR32HKhejp8x9lhtkqOqJ3yw8JaOZUNO1MsRgKq0sBa2nh7-3Bd4WGqTlgs  oh Joy,"""Mitt Romney has been asked to lead Health and Human Services in Biden administration."""
8831,neu,0,3,0,0,"Ew, is this true?

https://buffalochronicle.com/2020/11/07/mitt-romney-has-been-asked-to-lead-health-and-human-services-in-biden-administration/?fbclid=IwAR2dtVyJozaznOfI7kKbBCe6VXhwKryAsq48PRb9u4jXUspN3x435JG6nxg","""Mitt Romney has been asked to lead Health and Human Services in Biden administration."""
9002,pos,0,0,3,0,"Lock this asshat up already. People actually died bc they didn't receive their medication on time. Just lock him up. 

 https://www.rawstory.com/amp/usps-failed-to-deliver-27-percent-of-mail-in-ballots-in-south-florida-report-2649552498","""USPS failed to deliver 27% of mail-in ballots in South Florida"""
9120,pos,0,0,3,0,"American Patriots. Your election is being stolen.

Dem states are waiting to see how much you care. If the answer is not enough, they will find the Biden votes.

Six states can't get the votes counted
Six states in which Trump is leading
Six states where the Dems are in charge","""Six states can't get the votes counted. Six states in which @realDonaldTrump is leading. Six states where Dems are in charge."""
9170,pos,0,0,3,0,"Dems have removed any mention of ""God"" from their Platform. Why are they getting support from any Christian?","""Dems have removed any mention of 'God' from their Platform."""
9180,pos,0,0,3,0,"Joe Biden called Black Youth SUPER PREDATORS. They will NEVER like him, or vote for him. They are voting for ""TRUMP"".","""Joe Biden called Black youth super predators."""
9181,neg,3,0,0,0,Trump Falsely Claims Joe Biden Said 'Super Predators'. #Politics #BidenHarris2020 https://www.mediaite.com/trump/trump-mocked-for-false-claim-biden-called-black-youth-super-predators-he-thinks-hes-still-running-against-hillary/,"""Joe Biden called Black youth super predators."""
9330,pos,0,0,3,0,"Great first step, the charges in Kenosha will be dropped as well, as they should be. #kenosha #KyleRittenhouse @KCCCK94
@chris88len @knoernbl
https://www.chicagotribune.com/news/breaking/ct-kyle-rittenhouse-gun-20201013-cp5ecbdjx5didir6bwdkxyoa3m-story.html","""BREAKING NEWS: All Charges Dropped for Kyle Rittenhouse."""
9382,neg,3,0,0,0,"Random Falsehoods

Donald Trump
stated on September 29, 2020 in a debate:
Says ballots in Wisconsin ""are being dumped in rivers"" or creeks.

@MissioMusic #CanYouFeelTheSun @altnation #alt18","Says ballots in Wisconsin ""are being dumped in rivers"" or creeks."
9390,pos,0,0,3,0,"Correction but Breaking: Shredded Pennsylvania Mail in ballot Applications were discovered in a trailer.

The applications were for @realDonaldTrump. 

The video evidence was submitted by a fan to @oldrowswig from Old Row, a Barstool Sports Company 

This is not ok! Retweet.","""Shredded Pennsylvania Mail in ballot Applications were discovered in a trailer.
The applications were for @realDonaldTrump."""
9423,pos,0,0,3,0,"Our world ruler has said we are not allowed to return TIL normal until we TAKE his vaxcxcine. 
https://beforeitsnews.com/survival/2020/09/the-government-has-released-their-initial-plans-to-force-a-vaccine-on-everyone-2760185.html?fbclid=IwAR1x54-7jt_6kHuIp9LdXNG5r0Eld_-sI1N5051I1g6d76YHJn5W4UgQQ8g","""The government has released their initial plans to force a vaccine on everyone."""
9430,pos,0,0,3,0,The Government Has Released Their Initial Plans To Force a Vaccine on EVERYONE | Survival https://beforeitsnews.com/survival/2020/09/the-government-has-released-their-initial-plans-to-force-a-vaccine-on-everyone-2760185.html?fbclid=IwAR3DDLKhNrK4XuEC_vMYHW03o-ypeGo-rgJewFodtRxLTsFwjVD33DgcmuM        @SpeakerPelosi what can you tell the public about this. This is STUPID and unconstitutional,"""The government has released their initial plans to force a vaccine on everyone."""
9451,pos,0,0,3,0,"Harold Eubanks 16 September
Biden and Obama allowed grown men in restrooms with little girls. 
TRUMP has rescued over 300 missing children from pedophiles and perverts. 
Pick your President.","""Biden and Obama allowed grown men in restrooms with little girls. Trump has rescued over 300 missing children from (pedophiles) and perverts."""
