sentence_id,Max_Label,Negative_cnt,Neutral_cnt,Positive_cnt,Diff_cnt,tweet,claim
17863,neu,0,3,0,0,Q8: How many jobs could expanding Medicaid and closing the coverage gap bring to North Carolina? #CloseTheGapNC,"""Expanding Medicaid would bring 40,000 jobs to North Carolina."""
17952,pos,0,0,3,0," BizPac Review News  

 Texas Secretary of State finds 95,000 non-citizens registered to vote. 58k voted in one or more elections! 

https://www.bizpacreview.com/2019/01/26/texas-secretary-of-state-finds-95000-non-citizens-registered-to-vote-58k-voted-in-one-or-more-elections-717834/

 #MAGA  #2A #Prolife","""58,000 non-citizens voted in Texas, with 95,000 non-citizens registered to vote."""
18032,pos,0,0,3,0,"Lettuce killed more Americans this year than undocumented immigrants. But g'head with your ""national emergency"" smh","""Lettuce killed more Americans this year than undocumented immigrants."""
18101,neu,0,3,0,0,"""""Quotes Donald Trump as saying in 2013, ""A shutdown falls on the President's lack of leadership. He can't even control his own party and get people together in a room. A shutdown means the president is weak.""
In a Facebook post - Thursday, December 13, 2018""""","Quotes Donald Trump as saying in 2013, ""A shutdown falls on the President's lack of leadership. He can't even control his own party and get people together in a room. A shutdown means the president is weak."""
18320,pos,0,0,3,0,I URGE ALL VETERANS TO  VOTE REPUBLICAN THIS NOVEMBER BECAUSE THE DAMN DEMOCRATS BLOCKED THE VA HEALTHCARE BILL AGAIN,"Veterans should vote Republican ""because the damn Democrats blocked the VA Healthcare bill again."""
18323,pos,0,0,3,0,"Did you know West Virginia added the highest percentage of new construction jobs in 2017 in the United States, at 14.4%? This amounted to 4,300 additional jobs! In fact, #WV was the only state with double-digit growth! Read more://buff.ly/2Aav9fA #WVGOk:P","""West Virginia added the highest percentage of new construction jobs in 2017 in the United States, at 14.4%. This amounted to 4,300 additional jobs! In fact, #WV was the only state with double-digit growth!"""
18423,neg,3,0,0,0,"Donald Trump Says he didn't cancel a political rally because after Sept. 11, ""the New York Stock Exchange was open the following day."" LIE!!!

OPEN SIX DAYS LATER","Says he didn't cancel a political rally because after Sept. 11, ""the New York Stock Exchange was open the following day."""
18771,pos,0,0,3,0,We remember that the North American Free Trade Agreement business is one of them. The United States has lost thousands of jobs and millions of jobs. We have not registered for NAFTA yet. I didn't even take CK. We have a new agreement or go to the North American Free Trade Zone!,"Under the North American Free Trade Agreement, ""we lost millions of jobs."""
18861,neg,3,0,0,0,"Trump: 
""96 percent of the ""Trump News"" search results are from ""National Left-Wing Media.""""

Me:
96% of what Trump says is the result of him being bat shit crazy.

@realDonaldTrump
#Trump #MAGA @Google @facebook @Twitter","Says ""96 percent of (Google News) results on 'Trump News' are from National Left-Wing Media."""
19231,pos,0,0,3,0,"We need #Sense8murals in Alabama, Kansas, Michigan, Mississippi, North Dakota, Oklahoma, South Dakota, Texas, and Virginia. Any #Sense8fans and...
Read More
Republicans vote to make it legal nationwide to ban gays &amp; lesbians from adopting
https://www.lgbtqnation.com/","""Republicans vote to make it legal nationwide to ban gays and lesbians from adopting."""
19391,neg,3,0,0,0,"LIAR IN CHIEF

Trump:
""I have watched ICE liberate towns from the grasp of MS-13.""

...There is no evidence of this and ICE disputes claim.","""I have watched ICE liberate towns from the grasp of MS-13."""
19542,pos,0,0,3,0,"https://kdvr.com/news/nationalworld-news/family-crying-migrant-girl-on-time-magazine-cover-with-trump-was-not-separated-from-mother/amp/
The truth!!  #FakeNewsMedia #melaniajacket #BorderCrisis #BuildTheWall","""Migrant mother and 'crying girl' on Time cover never separated."""
20012,neu,0,3,0,0,"""Since the end of the financial crisis, we have seen an average of one community bank or credit union disappear every day."" -- U.S. Rep. Keith Rothfus","""Since the end of the financial crisis, we have seen an average of one community bank or credit union disappear every day."""
20090,dif,0,1,0,3,"Despite the public praise, ""Justice Kennedy is reviled by many of Mr. Trump's supporters"" for his votes upholding access to abortion, expanding gay rights, and limiting the death penalty in the United States -- all issues that are subject to change with a more conservative Judge","""Trump votes for death penalty for being gay."""
20133,neg,3,0,0,0,"THE DAILY LIE
Trump's Lie: ""I doubled my African-American poll numbers. We went from 11 to 22 in one week.""

The Truth: this statement is based on a single, highly flawed study.","""I doubled my African-American poll numbers. We went from 11 to 22 in one week."""
20211,neg,3,0,0,0,"THE DAILY LIE
Trump's Lie: The nuclear deal gave Iran ""$150 billion, giving $1.8 billion in cash -- in actual cash carried out in barrels and in boxes from airplanes.""

The Truth: estimates show the nuclear deal gave Iran around $25-50 billion","The nuclear deal gave Iran ""$150 billion, giving $1.8 billion in cash -- in actual cash carried out in barrels and in boxes from airplanes."""
20380,pos,0,0,3,0,"When car sent the States China, is Tariff be of 1/2%. a is to from United, there a to paid 25%. that like or trade., it like TRADE- going for!","""When a car is sent to the United States from China, there is a Tariff to be paid of 2 1/2%. When a car is sent to China from the United States, there is a Tariff to be paid of 25%."""
20382,pos,0,0,3,0,"Are You Ready - Nancy Pelosi Vows Democrats Will Raise Taxes if They Take Back the House at a ""Repeal the Trump Tax"" Town Hall (VIDEO) http://joycebentley.com/are-you-ready-nancy-pelosi-vows-democrats-will-raise-taxes-if-they-take-back-the-house-at-a-repeal-the-trump-tax-town-hall-video/","""Nancy Pelosi vows Democrats will raise taxes if they take back the House."""
20531,neg,3,0,0,0,"Daily Lie: last year we lost $500 billion on trade with China.

The Truth:  the value of Chinese goods imported to the United States exceeded American goods exports to China by roughly $375 billion","""Last year we lost $500 billion on trade with China."""
21083,neg,3,0,0,0,"THE DAILY LIE
Trump's Lie: ""You take Pulse nightclub. If you had one person in that room that could carry a gun and knew how to use it, it wouldn't have happened, or certainly to the extent that it did.""  

The Truth:  an armed guard was present at the Pulse Nightclub shooting","""You take Pulse nightclub. If you had one person in that room that could carry a gun and knew how to use it, it wouldn't have happened, or certainly to the extent that it did."""
21111,neg,3,0,0,0,"TRUMP: ""I have been much tougher on Russia than Obama, just look at the facts. Total Fake News!"" -- tweet Tuesday

THE FACTS: The Trump administration actually lags the Obama administration on this front, by all public evidence","""I have been much tougher on Russia than Obama, just look at the facts. Total Fake News!"""
21120,neu,0,3,0,0,"""There are more guns in this country than there are people,""'excluding guns in the military, guns in police forces. Can we disarm the police?--Angela Davis","""There are more guns in this country than there are people."""
21121,dif,0,0,0,3,These people in my mentions are wigging the fuck out because they care more about their guns than they do about the future of their country.,"""There are more guns in this country than there are people."""
21130,dif,0,0,0,3,"What!? @realDonaldTrump suggests the way to deal with school shootings is to arm teachers with guns!?

How will giving more people guns actually solve the problem?

I'm so glad I live in a country where guns are tightly controlled!","""There are more guns in this country than there are people."""
21152,pos,0,0,3,0,"One third of Floridians own guns!!
Amazing. There has to be major gun regulations..
If the numbers go up and we all own guns what then?
If anyone should fear this it should be trump.
Just sayin'","""One-third of Floridians own guns. One-third."""
21462,neg,3,0,0,0,Rauner says he's introduced balanced budgets each year he's been governor. There's more than a few experts who will dispute that.,"""I have introduced balanced budgets every year that I've been governor."""
21500,dif,0,0,0,3,"Business start ups at all time high but out of the UK's 5.7m small businesses, only 1.7 per cent applied for a loan or overdraft last year, the fifth consecutive year of decline since 2012. Clearly measure of business confidence in our banks - so important that decline reversed","""Small business confidence is at an all-time high."""
21501,pos,0,0,3,0,"""Small business confidence is at an all time high "" @realDonaldTrump 
I totally agree. 
 #localfirstAZ #shopsmall #shoplocal #POTUS
#MAGA #Flagstaff #USA #SOTU","""Small business confidence is at an all-time high."""
21502,neg,3,0,0,0,Trump just said that small business confidence is a all time high. 2017 was the worst year I've had in business in the past 12 years. I have no confidence! I guess it's Obama's fault!,"""Small business confidence is at an all-time high."""
21512,neu,0,3,0,0,"#SOTU ""after years &amp; years of wage stagnation, we are finally seeing rising wages. Unemployment claims have hit a 5 year low.""","""After years of wage stagnation, we are finally seeing rising wages."""
21520,pos,0,0,3,0,"Somebody please inform Jay-Z that because of my policies, Black unemployment has been reported to be at the LOWEST RATE EVER RECORDED!","""Because of my policies, Black Unemployment has just been reported to be at the LOWEST RATE EVER RECORDED!"""
21521,neg,3,0,0,0,"Prez: ""Because of my policies, Black Unemployment has just been reported to be at the LOWEST RATE EVER RECORDED!""
Truth: Because of Obama's policies, Black Unemployment has just been reported to be at the LOWEST RATE EVER RECORDED!","""Because of my policies, Black Unemployment has just been reported to be at the LOWEST RATE EVER RECORDED!"""
21571,pos,0,0,3,0,"This is voter fraud
 https://t.co/X7ntzE5mcx?amp=1","""California To Register Illegal Aliens To Vote - Automatically."""
21881,neg,3,0,0,0,"THE DAILY LIE:
Trump's Lie: The Senate seat won in a special election by a Democrat had been ""held for more than thirty years by Republicans."" 
The Truth: It was actually 21.","The Senate seat won in a special election by a Democrat had been ""held for more than thirty years by Republicans."""
22011,neg,3,0,0,0,"THE DAILY LIE:

Trump's Lie: ""We essentially repealed  Obamacare because we got rid of the individual mandate ... and that was a  primary source of funding of Obamacare.""  
The Truth: This is a small change to disrupt one part of Obamacare, not a  fatal blow.","""We essentially repealed Obamacare because we got rid of the individual mandate ... and that was a primary source of funding of Obamacare."""
23280,neg,3,0,0,0,"JOKE: North Carolina Speaker State Sen. Phil Berger says
State has ""the strictest anti-gerrymandering standards in the entire country.""","North Carolina has ""the strictest anti-gerrymandering standards in the entire country."""
23284,neu,0,3,0,0,"Cruz on town halls: In 2017, I've done 17 town halls...The campaign that [originally] elected me was a grassroots campaign #TribFest17","""In 2017, I've done 17 town halls."""
23602,pos,0,0,3,0,"..NFL attendance and ratings are WAY DOWN in VR. Boring games yes, but many stay away because they love our country. League should back U.S.","""NFL attendance and ratings are WAY DOWN. Boring games yes, but many stay away because they love our country."""
23963,neu,0,3,0,0,"""We have become an energy exporter for the first time ever just recently,"" Trump said, before touting American workers ""can build anything.""","""We have become an energy exporter for the first time ever just recently."""
24011,pos,0,0,3,0,"Foxconn is bringing 13,000 high-tech jobs to Wisconsin -- the biggest jobs announcement in our state's history!","""Foxconn is bringing 13,000 high-tech jobs to Wisconsin."""
24144,neg,3,0,0,0,No GOP proposals 1) Cover more Americans 2) Makes health care more affordable &amp; 3) Saves Medicaid from brutal cuts for those most in need.,"There ""are not cuts to Medicaid"" in the GOP health care proposals."
24711,pos,0,0,3,0,BREAKING NEWS: FBI Uncovers Evidence That 62 Million Trump Voters Are All Russian Agents  https://rightwingnews.com/humor/breaking-news-fbi-uncovers-evidence-62-million-trump-voters-russian-agents/,"""FBI uncovers evidence that 62 million Trump voters are all Russian agents!"""
25172,pos,0,0,3,0,For the record. Hate speech isn't protected by the first amendment. It's a terroristic threats in most cases,"""Hate speech is not protected by the first amendment."""
25212,neu,0,3,0,0,"Howard Dean, former Vermont Governor &amp; DNC Chair: ""Hate speech is not protected by the first amendment""
https://www.washingtonpost.com/news/the-fix/wp/2017/04/21/whats-the-deal-with-howard-dean/","""Hate speech is not protected by the first amendment."""
25222,neg,3,0,0,0,#howarddean may be complete behind hole The problem is his kind dont know it N wouldn't care if they did https://www.thegatewaypundit.com/2017/04/idiot-howard-dean-gets-destroyed-claiming-hate-speech-not-protected-first-amendment/ #1stAmndmnt,"""Hate speech is not protected by the first amendment."""
25551,pos,0,0,3,0,This is the dawning of a golden age Colorado Rockies Baseball Team To Sell Marijuana Brownies At Concession Stands #.UxXGAxBf3V4.twitter,"""Colorado Rockies baseball team to sell marijuana brownies at their concession stands."""
25662,neg,3,0,0,0,"Head of EPA is an idiot too!  ""No, I would not agree carbon dioxide is a primary contributor to the global warming that we see.""","Carbon dioxide is not ""a primary contributor to the global warming that we see."""
25892,neu,0,3,0,0,"-@POTUS says he's sending Congress a budget that ""calls for one of the largest increases in national defense spending in American history.""","Says his budget ""calls for one of the largest increases in national defense spending in American history."""
26142,neg,3,0,0,0,"Trump, 23 Jan: ""(The lying media) sort of made it sound like I had a feud with the intelligence community.""
Trump, today: feuds with IC.","""The media ... sort of made it sound like I had a feud with the intelligence community."""
26212,neg,3,0,0,0,".@RealDonaldTrump is wrong, Americans do care about his tax returns. Read more here: https://www.huffpost.com/entry/donald-trump-says-americans-dont-care-about-his-tax-returns-hes-dead-wrong_n_5876604ce4b092a6cae44fb8 #USWWorks","Americans don't ""care at all"" about Donald Trump's tax returns."
26241,neu,0,3,0,0,"US President-elect Donald Trump says Americans ""don't care"" he hasn't released his tax returns, as previous presidents have done","Americans don't ""care at all"" about Donald Trump's tax returns."
26260,pos,0,0,3,0,"I will not be silent. Martin Luther King Jr. said, ""Our lives begin to end the day we become silent about things that matter.""","""Martin Luther King said our lives begin to end the day we become silent on things that matter."""
26270,pos,0,0,3,0,"Julian Assange says John Podesta's email password was ""password"".  I have worked with people like Podesta &amp; I've seen this over and over.","Says John Podesta's email password was ""password."""
26292,pos,0,1,3,0,rump-roast: Jackie Evancho's album sales have skyrocketed after announcing her Inauguration performance. Once again-focus on governing!,"""Jackie Evancho's album sales have skyrocketed after announcing her inauguration performance."""
26330,pos,0,0,3,0,"Since the Sandy Hook tragedy, more than seven children PER DAY have died from gun violence. We can no longer be silent. #EndGunViolence","""Since the Sandy Hook tragedy, more than seven children PER DAY have died from gun violence."""
26812,pos,0,0,3,0,Report: 3 Million Votes In Presidential Election Cast By Illegal Aliens God is on our side when the right person won!- PATDOLLARD p://po.st/,"""Report: 3 million votes in presidential election cast by illegal aliens."""
27120,pos,0,0,3,0,"1928 was last time Republicans had the White House, the House and the Senate. . . Think things ain't bout to change if you want to","""1928 was last time Republicans had the White House, the House and the Senate."""
27211,neu,0,3,0,0,"*Trump tweet in October: ""Wow, Twitter, Google and Facebook  are burying the FBI criminal investigation of Clinton. Very dishonest  media!""","""Twitter, Google and Facebook are burying the FBI criminal investigation of Clinton. Very dishonest media!"""
27604,pos,0,0,3,0,Ford Small Car Production  says still moving to Mexico..shoop doo ba doo doo ba doo doo ba doo ba doo ba doostand by.,"""Ford is moving all of their small-car production to Mexico."""
27620,pos,0,0,3,0,Time you #Boycott Ford.... they are still moving all small vehicle production to mexico. They won't be worth buying  after tax per car. bye,"""Ford is moving all of their small-car production to Mexico."""
27643,neu,0,3,0,0,Trump: Hillary Clinton wanted the wall (in '06 he says) #debate,"Says Hillary Clinton ""wanted the wall."""
27704,neu,0,3,0,0,Hillary Clinton says America has had Muslims since George Washington #Debates #Debate #Debate2016,"""We've had Muslims in America since George Washington."""
27740,neu,0,3,0,0,"""I was gone"" @HillaryClinton corrects @realDonaldTrump on Obama's red line on Syria","""I was gone"" when there was a red line against Syria."
27823,neg,3,0,0,0,"'The record shows that I'm right, I didn't support the war in Iraq'

Ummmmmm... no it doesn't?","""I did not support the war in Iraq ... The record shows that I'm right."""
27841,neg,3,0,0,0,"Trump this week said African-American communities are in the worst shape ""ever, ever, ever."" Man even worse that that period from 1600-1865?","""Our African-American communities are absolutely in the worst shape they've ever been in before. Ever. Ever. Ever."""
27943,neg,3,0,0,0,"""Our veterans, in many cases, are being treated worse than illegal immigrants.""  Apprentice Star talks shit he doesnt understand  #trumplied","""Our veterans, in many cases, are being treated worse than illegal immigrants."""
27961,neu,0,3,0,0,"Says US govt has no idea how many illegal immigrants are in US, number could be as low as 3 or as high 30 million.

#TrumpAZ #Immigration","The number of illegal immigrants ""could be 3 million. It could be 30 million."""
27962,neu,0,3,0,0,"TRUMP:  Illegal immigration costs our country more than $113 billion dollars a year.
  #ma4trump #massGOP #MAGA #masspoli","""Illegal immigration costs our country more than $113 billion a year."""
28003,neg,3,0,0,0,"Trump lies: ""The Obama administration gave Iran ""$400 million in ransom payment cash."" 8/24/16 #WhyDictatorDonMustNeverBePresident","The Obama administration gave Iran ""$400 million in ransom payment cash."""
28022,neu,0,3,0,0,"Tim Kaine about @realDonaldTrump : ""Even Richard Nixon released his tax returns to the public when he was running for president,""#taxreturns","""Even Richard Nixon released his tax returns to the public when he was running for president ..."""
28042,pos,0,0,3,0,California is home to the largest death row population in the Western Hemisphere at 750. Florida is next at 388. #prison #crime #stats #cali,"""California is home to the largest death row population in the Western Hemisphere."""
28052,neg,3,0,0,0,"""they Obama Clinton war on coal cost Michigan over 50,000 jobs"" Donald Trump lied lied#WhyDictatorDonMustNeverBePresident","""The Obama-Clinton war on coal has cost Michigan over 50,000 jobs."""
28121,neu,0,3,0,0,"""I'm proud we put a lid on #Iran's nuclear program without firing a single shot,"" #Clinton says, adding US must ""ensure #Israel's security.""","""We put a lid on Iran's nuclear program without firing a single shot."""
28162,neg,3,0,0,0,Trump lied at RNC Convention when he said America is one of highest taxed Nations in the World #WhyDictatorDonMustNeverBePresident,"""America is one of the highest-taxed nations in the world."""
28260,neu,0,3,0,0,Scott Baio: Actor Says President Barack Obama Is Either 'Muslim' or 'Muslim Sympathizer'   WHO !!!!!!!!!!!!!!!!!!!!!!!!!!!!!!!!!!!!!!!!!!!!!,"Says President Barack Obama is ""absolutely"" a Muslim."
28280,pos,0,0,3,0,"Today is the 240th birthday of the world's oldest and greatest experiment in democracy, the United States of America!","The United States is ""the oldest democracy"" in the world."
28402,neu,0,3,0,0,"Hillary Clinton about Donald Trump today: ""He says he has foreign policy experience because he ran the Miss Universe pageant in Russia"".","Says Donald Trump ""says he has foreign policy experience because he ran the Miss Universe pageant in Russia."""
28451,pos,0,0,3,0,"I recently heard in a news report that 80,000 people left Puerto Rico last year. I think they all moved to Kissimmee Fl.","""Almost 100,000 people left Puerto Rico last year."""
28504,neg,3,0,0,0,"""Every minute in Africa, a child dies of malaria""... I do not bliv this for a second! :?","""In Africa, a child dies every minute because of (malaria)."""
28540,pos,0,0,3,0,"""unfortunately i remain one of the poorer members of the united states senate"" 

I LOVE THIS MAN SO MUCH","""I remain one of the poorer members of the United States Senate."""
28561,neu,0,3,0,0,"Coming Friday: John Kasich says ""there are no rules governing"" the 2016 Republican convention, ""the rules have not be set."" #JSPolitics","""There are no rules governing"" the 2016 Republican convention, ""the rules have not been set."""
28630,neu,0,3,0,0,"""@PolitiFact: Clinton ad says it's been 15 years since Americans had a raise.$7.25 is the federal minimum wage since 2009. 15 yrs ago$5.15.","""Americans haven't had a raise in 15 years."""
28650,neg,3,0,0,0,"Trump just said GDP was close to zero in the last two quarters. Surely he means growth, right? I mean, he's wrong either way...","""GDP was zero essentially for the last two quarters."""
28751,pos,0,0,3,0,"Seems like a waste of tax payer money. 
""Nothing was done. I mean, $25 million was spent, but we don't have that (gun ownership) database.""","""Nothing was done. I mean, $25 million was spent, but we don't have that (gun ownership) database."""
28811,neu,1,3,0,0,"""We aren't going to tear up the affordable care act, I helped write it"" ","""I helped write"" the Affordable Care Act."
28812,neu,0,3,0,0,Bernie said I have receipts...I helped write the affordable health care act...BOOM! #DemDebate,"""I helped write"" the Affordable Care Act."
28821,neg,3,0,0,0,"Hillary Clinton 
"" we have driven health care costs down to the lowest cost in the past 50 years"" 1-17-16

What is this lady smoking?","""We now have driven (health care) costs down to the lowest they've been in 50 years."""
28880,pos,0,0,3,0,"Jeb!: ""Peace through strength,"" rebuild military.  Never mind we spend more on the military than the next eight nations combined. #GOPDebate","""We spend more on our military than the next eight nations combined."""
28891,neu,0,3,0,0,"""Many Americans are still feeling the squeeze of an #economy too weak to raise #income levels."" @Nikkihaley #SOTU16","The economy is ""too weak to raise income levels."""
28911,neu,0,3,0,0,"Donald Trump: Says American polling shows Russian President Vladimir Putin has ""an 80 percent approval rating... carlot@getresponse.net","Says American polling shows Russian President Vladimir Putin has ""an 80 percent approval rating."""
29032,pos,0,0,3,0,#Texas is on the job: RT@GregAbbott_TX THIS is y TX is vigilant about Syrian refugees--&gt; REPORT: 8 Syrians Caught @ Texas Border in Laredo.,"""8 Syrians caught at Texas border in Laredo."""
29253,pos,0,0,3,0,"""I don't know why we've stigmatized vocational careers...Welders make more money than philosophers."" !!!!! YES!! @marcorubio #agjobsrock","""Welders make more money than philosophers."""
29270,neu,0,3,0,0,"Rand: ""Income inequality seems to be worst in cities run by Democrats, states run by Democrats and countries currently run by Democrats.""","Income inequality ""seems to be worst in cities run by Democrats."""
29360,neu,0,3,0,1,".@MarcoRubio: America is falling behind bc ""We have the highest business tax rate in the industrialized world."" #GOPDebate","""We have the highest tax rate anywhere in the world."""
29600,dif,0,1,0,3,"Rep. Walter Jones (R-NC) believes in ""liberty"" but doesn't believe in ""freedom"" - he's one of few Republicans who voted for Iran deal","""I was one of the few, very few, who voted `no' on the Iran deal."""
29614,neg,3,0,0,0,"JEB BUSH LIAR said Planned Parenthood is ""not actually doing women's health issues_PP offers many medical services related to women's health","Planned Parenthood is ""not actually doing women's health issues."""
29650,neu,1,3,0,0,"Hillary: ""If I had not asked for my emails all to be made public, none of this would have been in the public arena""
#Benghazi investigation?","""If I had not asked for my emails all to be made public, none of this would have been in the public arena."""
30203,neg,3,0,0,0,"GEORGE WILL
Says President Ronald Reagan ""had a month of job creation of 1 million.""  Not even close. Based on a debunked claim","Says President Ronald Reagan ""had a month of job creation of 1 million."""
30241,neg,3,0,0,0,"""Research says whales live just as long here as they do in the wild"" RLY BC 35 years old is the same as 100????? No #seaworld","""Whales live as long at SeaWorld"" as they do in the wild."
