sentence_id,Max_Label,Negative_cnt,Neutral_cnt,Positive_cnt,Diff_cnt,tweet,claim
2270,pos,0,0,3,0,SHOCKING!!! Dr. Zelenko &amp;quot;The COVID-19 Vaccines Cause AIDS!&amp;quot; + Exposing &amp;quot;The Great Reset&amp;quot; Agenda https://rumble.com/vsbyao-shocking-dr.-zelenko-the-covid-19-vaccines-cause-aids-exposing-the-great-re.html,The COVID-19 vaccines cause AIDS.
2271,neg,3,0,0,0,This nut job is a SENATOR.  Jesus fucking Christ. https://madison.com/news/local/govt-and-politics/sen-ron-johnson-says-it-may-be-true-that-covid-19-vaccines-cause-aids/article_b14bf2c0-9bf3-59a4-99ea-1639e53f7abb.html,The COVID-19 vaccines cause AIDS.
2275,neg,3,0,0,0,"https://madison.com/news/local/govt-and-politics/sen-ron-johnson-says-it-may-be-true-that-covid-19-vaccines-cause-aids/article_b14bf2c0-9bf3-59a4-99ea-1639e53f7abb.html
Besides Trump Ron Johnson  LIE like most Republican SENATORS.",The COVID-19 vaccines cause AIDS.
2284,neg,3,0,0,0,Sen. Ron Johnson says it 'may be true' - but no it is not true - that COVID-19 vaccines cause AIDS https://madison.com/news/local/govt-and-politics/sen-ron-johnson-says-it-may-be-true-that-covid-19-vaccines-cause-aids/article_b14bf2c0-9bf3-59a4-99ea-1639e53f7abb.html,The COVID-19 vaccines cause AIDS.
2291,neg,3,0,0,0,"Ron Johnson Says It 'May Be True' COVID Vaccines Cause AIDS: It is no secret that Ron Johnson is an antivaxxer and has been one of the biggest sources of anti-vaccine misinformation. RoJo has spread various ""alternative treatments.. via crooksandliars https://crooksandliars.com/2022/05/johnson-it-may-be-true-covid-19-vaccines",The COVID-19 vaccines cause AIDS.
2331,pos,0,0,3,0,"Here's the proof. 
Re aids and hiv n jabs  https://www.nutritruth.org/single-post/investigation-the-covid-19-vaccines-cause-aids-here-s-all-the-evidence",The COVID-19 vaccines cause AIDS.
2410,neu,0,3,1,0,"I wouldn't be surprised if Biden nominates Kamala Harris to SCOTUS due to her shrinking poll numbers, replaces Harris with Hillary as VP, and then steps down, making Hillary President.","""Hillary replaces Kamala Harris."""
2431,dif,0,0,0,4,Who voted for a New World Order?  You damn Liberals all voted for this?  Did you know this was the future of the ?  Wtf???????  We should all be fighting back.  They are all out of their minds on the Left!!!! https://www-foxnews-com.cdn.ampproject.org/c/s/www.foxnews.com/media/high-gas-prices-worth-future-liberal-world-order-white-house-economics-adviser-tells-cnn.amp,"Gas prices were ""$1.86 when I left"" the White House."
2442,dif,0,0,0,3,"IT'S ABOUT TIME.

*Six years* after anonymous sold out to the Trump campaign, the Left finally gets on board with hiring skilled labor.

https://www.foxbusiness.com/markets/white-house-tiktok-stars-putin-gas-prices","Gas prices were ""$1.86 when I left"" the White House."
2461,dif,0,0,0,3,"When I turn the tap, water comes out.

https://news.sky.com/story/covid-19-less-than-two-thirds-of-people-self-isolating-after-testing-positive-for-coronavirus-figures-show-12577325","""Tap water is testing positive for COVID!"""
2481,pos,0,0,3,0,"On the FIRST day of the Ghislaine Maxwell trial:  The CEO of Twitter resigned. The CEO of Walmart resigned. The CEO of CNBC resigned Just a coincidence???
 o The FAA accidentally disclosed more than 2000 flight records associated with Jeffrey Epstein's private jets.","""On the first day of the Ghislaine Maxwell trial, the CEO of Twitter resigned, the CEO of Walmart resigned, the CEO of CNBC resigned"""
2502,pos,0,0,3,0,Check It Out https://www.micdroppolitics.com/articles/covid-death-rates-4-to-1-vaccinated-to-unvaxxed/,"""COVID death rates 4 to 1, vaccinated to unvaxxed"""
2531,pos,0,0,3,0,Spike Protein Goes to Nucleus and Impairs DNA Repair (In-Vitro Study - N... https://www.youtube.com/watch?v=-SYL-iU0E9Q&feature=youtu.be via @YouTube,"""Spike protein goes to nucleus and impairs DNA repair."""
2550,pos,0,0,3,0,https://www.micdroppolitics.com/articles/german-news-agency-tracks-75-prominent-athletes-suddenly-dead-of-heart-attacks-after-covid-vax/ Fauci &amp; Gates' population control at work!!!,"""German News Agency Tracks 75 Prominent Athletes Suddenly Dead Of Heart Attacks After COVID Vax"""
2570,neu,0,3,0,0,"""the vaccines contain a bioluminescent marker called LUCIFERASE so that you can be tracked.""

""Read the last book of the New Testament to see how this ends,""

https://www.theepochtimes.com/newsmax-reporter-permanently-suspended-from-twitter-for-spreading-covid-19-misinformation_4096496.html?utm_campaign=socialshare_twitter&utm_source=twitter.com",COVID-19 vaccines contain luciferase.
2583,pos,0,0,3,0,"Biden's Treasury nominee, Saule Omarova, wants to get rid of all private bank accounts &amp; all private deposits &amp; to have a Federal bank control all bank accounts in the U.S.  She is a full blown communist tyrant.
https://neonnettle.com/news/17385-biden-s-banking-nominee-demands-all-private-bank-accounts-be-eliminated","""Biden's banking nominee demands all 'private bank accounts' be eliminated"""
2592,neg,3,0,0,0,"Looking for news on whether Bush has made a statement on Putin's invasion of Ukraine, I came across this article. Haven't heard much of Q lately but it seems they keep getting crazier and crazier. How do they manage to think this is real? 
https://trusttheq.com/military-arrests-former-president-george-w-bush/","""Military arrests former President George W. Bush."""
2643,pos,0,0,3,0,NAVY SEALs Raid Cargo Ship Full of Smuggled Children - Commiefornia in the Forefront! | Adina Kutnicki https://adinakutnicki.com/2021/11/03/navy-seals-raid-cargo-ship-full-of-smuggled-children-commiefornia-in-the-forefront/,"""NAVY SEALs raid cargo ship full of smuggled children."""
2650,pos,0,0,3,0,"Thank you Lord, thank you Seals

https://roserambles.org/2021/11/04/navy-seals-raid-cargo-ship-full-of-smuggled-children-november-4-2021/","""NAVY SEALs raid cargo ship full of smuggled children."""
2801,pos,0,0,3,0,"You voted against it confirms most don't understand why the GOP tried to stop the infrastructure bill.  When only 10% of the $2T is ticketed for true infrastructure, it should be stopped.  Most of the remaining money is wasted on nonsense the radical left dreams up.","""The infrastructure bill itself is only 10% true infrastructure."""
2802,dif,0,0,0,3,"Measures I authored in this bill will address risks within our supply chain and strengthen the cybersecurity of our critical infrastructure systems.
https://www.waer.org/news/2021-12-10/major-defense-spending-act-includes-measures-authored-by-rep-john-katko-to-address-cybersecurity-supply-chain-threats","""The infrastructure bill itself is only 10% true infrastructure."""
2810,dif,0,0,0,3,"Mothers Against Drunk Driving said it could save 10,000 lives a year.
https://www.wtxl.com/news/national/drunk-driving-prevention-tech-included-in-infrastructure-bill","""The infrastructure bill itself is only 10% true infrastructure."""
2813,dif,0,0,0,3,Here's what's next for the infrastructure package in New Hampshire https://www.nhpr.org/nh-news/2021-11-10/infrastructure-bill-congress-new-hampshire,"""The infrastructure bill itself is only 10% true infrastructure."""
2891,neu,0,3,0,0,"I am still not sure about shedding, of course close contact with the inoculated cannot be avoided. https://breaking-news.ca/pfizer-documents-confirms-covid-vaccinated-people-can-shed-spike-proteins-and-harm-the-unvaccinated/","""Pfizer Confirms COVID-Vaccinated People Can 'Shed' Spike Proteins And Harm The Unvaccinated"""
2892,pos,0,0,3,0,As we all knew. https://thewatchtowers.org/pfizer-documents-confirms-covid-vaccinated-people-can-shed-spike-proteins-and-harm-the-unvaccinated/,"""Pfizer Confirms COVID-Vaccinated People Can 'Shed' Spike Proteins And Harm The Unvaccinated"""
3092,pos,0,0,3,0,"Lookie lookie

#LetsGoBrandon

https://foreignaffairsintelligencecouncil.wordpress.com/2021/11/05/ceo-of-pfizer-arrested-charged-with-fraud-media-blackout/","""CEO of Pfizer arrested, charged with fraud."""
3210,pos,0,0,3,0,"#ElonMusk #to #donate $250 #billion for #reparations to #AfricanAmericans in U.S."" #NewsBreak  https://www.newsbreak.com/news/2426538079084/elon-musk-to-donate-250-billion-for-reparations-to-african-americans-in-u-s?noAds=1&_f=app_share&s=a2&share_destination_id=MTY1MTg2OTYxLTE2MzYzOTM4MjA1NDI=","""Elon Musk to donate $250 billion for reparations to African Americans in U.S."""
3211,pos,0,0,3,0,"This should be interesting as to How &amp; who will distribute this BS-Money. I can't imagine plus the Democrats will claim it was Their Idea for Votes!!

Elon Musk to donate $250 billion for reparations to African Americans in U.S."" #NewsBreak  https://www.newsbreak.com/news/2426538079084/elon-musk-to-donate-250-billion-for-reparations-to-african-americans-in-u-s?noAds=1&_f=app_share&s=a2&share_destination_id=MTY2NDI1MTk5LTE2MzYyODgyNjYyODk=","""Elon Musk to donate $250 billion for reparations to African Americans in U.S."""
3212,pos,0,0,3,0,That will shut us up actual South African man https://www.newsbreak.com/news/2426538079084/elon-musk-to-donate-250-billion-for-reparations-to-african-americans-in-u-s?noAds=1&_f=app_share&s=a7&share_destination_id=MTY0MDY4MTEwLTE2MzYyNjE2NzI1NzE= @elonmusk @neiltyson @icecube,"""Elon Musk to donate $250 billion for reparations to African Americans in U.S."""
3221,dif,0,0,0,4,"""Let's step back for a moment and ask, ""What do Democrats really want most?""

The answer is simple. They want the..."" https://www.nationalreview.com/2022/01/the-democrats-long-term-strategy-to-pack-the-supreme-court/#%23Let%E2%80%99s+step+back+for+a+moment+and+ask%2C+%E2%80%9CWhat+do+Democrats+really+want+most%3F%E2%80%9D+The+answer+is+simple.+They+want+the+virtually+unlimited+power+that+control+of+all+three+branches+of+government+would+give+them.+The+next+time+elections+give+them+control+of+the+White+House+and+a+workable+majority+control+of+Congress%2C+they+will+also+want+control+of+the+U.S.+Supreme+Court.+With+control+of+the+Court%2C+they+could+adopt+measures+that+the+current+majority+of+the+Court+would+probably+consider+unconstitutional.+Those+would+include%3A+%2A+Reversing+the+Supreme+Court%E2%80%99s+Citizens+United+decision+and+imposing+strict+controls+on+independent+speech+in+political+campaigns.+%2A+Imposing+national+redistricting+standards+by+judicial+fiat+on+states.+%2A+Appointing+activists+to+an+expanded+Federal+Election+Commission%2C+the+Justice+Department%2C+or+another+federal+agency+that+would+dictate+the+rules+for+voting+and+vote+counting+in+the+states.+%2A+Guaranteeing+constitutional+success+for+their+strategy+of+sidelining+the+Electoral+College+and+disempowering+voters+in+all+but+the+biggest+states%2C+through+the+%E2%80%9CNational+Popular+Vote%E2%80%9D+compact.+%2A+Rewriting+labor+law+to+disadvantage+independent+workers+in+the+gig+economy+and+those+who+work+for+small+business%2C+to+force+them+to+join+the+unions+that+fund+Democratic+campaigns.+%2A+Ensuring+that+major+universities+continue+to+discriminate+by+race%2C+especially+against+over-achieving+Asians+and+other+disfavored+groups%2C+in+their+admission+policies%2C+in+the+name+of+%E2%80%9Cdiversity.%E2%80%9D+%2A+Cementing+the+power+of+federal+regulators+to+rule+and%2C+if+necessary%2C+intimidate+uncooperative+entities+and+persons+by+administrative+decrees.+%2A+Forcing+conservative+nonprofit+groups+to+reveal+their+donors+so+that+those+donors+can+be+intimidated+by+%E2%80%9Cwoke%E2%80%9D+political+allies+of+the+Left.+%2A+Restoring+the+ability+of+teachers%E2%80%99+unions+to+collect+dues+from+nonmembers+and+excluding+schools+run+by+religious+groups+from+eligibility+for+school-choice+funding+by+states%2C+thereby+stifling+efforts+to+expand+parental+choice+in+education.+%2A+Weakening+Second+Amendment+rights.+%2AStriking+down+laws+passed+by+state+legislatures+on+abortion+and+religious+freedom+that+the+Left+doesn%E2%80%99t+like.","""States run elections, not the federal government."""
3280,pos,0,0,3,0,New post: Japan drops vax rollout as only therapy for COVID-19 and allows Ivermectin as well http://robert-gorter.info/japan-drops-vax-rollout-therapy-covid-19-allows-ivermectin-well/?utm_campaign=berlin-1993-2000&utm_medium=twitter&utm_source=twitter,"""Japan drops vax rollout"""
3301,neu,0,3,1,0,Thoughts ??? https://nexusnewsfeed.com/article/health-healing/japan-drops-vax-rollout-goes-to-ivermectin-ends-covid-almost-overnight,"""Japan drops vax rollout"""
3302,pos,0,0,3,0,"Yes!  It is true!  Big tech is trying to censor this story  Found this on Belgium News source!!  @newsmax @vincentrhodestv @joerogan   @WayneDupreeShow @DFBHarvard @NextNewsNetwork @ChaChaC87311797 @Dlw20161950 @EpochTimes     
https://world-signals.com/news/2021/10/31/japan-drops-vax-rollout-goes-to-ivermectin/","""Japan drops vax rollout"""
3351,pos,0,0,3,0,"hey @CPHO_Canada @fordnation @GovCanHealth ENOUGH ok? We know the game!! @mounties4free 
https://thesecondnews.com/japan-drops-vax-rollout-goes-to-ivermectin-ends-covid-almost-overnight/","""Japan drops vax rollout"""
3361,pos,0,0,3,0,BREAKING! TRUMP IS IN WHITE HOUSE! HE PROMISES TO LOCK UP HILLARY! https://www.youtube.com/watch?v=0DYG24rWqtA&feature=youtu.be via @YouTube,"""Trump is in White House! He promises to lock up Hillary!"""
3431,pos,0,0,3,0,"Wait if Jeff bezos has
200 billion dollas and
there's 7 billion people
on earth why can't we
each get a billion and
he's be left with 193
billion dollas left","""If Bezos has 200 billion dollas, and there's 7 billion people on earth, why can't we each get a billion and (he'd) be left with 193 billion dollas?"""
3432,pos,0,0,3,0,"HUGE NEWS! BIDEN RESIGNED, PELOSI WAS DETAINED https://www.youtube.com/watch?v=07RahweKO70&feature=youtu.be via @YouTube","""Biden resigned, Pelosi was detained."""
3532,pos,0,1,3,0,"I know so many people that have covid now &amp; in 3 states! Vaccines should have been mandatory! We'd nearly be over this or DONE! Senseless and ignorant! 
You're Far Less Likely to Spread the Coronavirus If You're Vaccinated https://www.healthline.com/health-news/vaccinated-people-can-transmit-the-coronavirus-but-its-still-more-likely-if-youre-unvaccinated","People who are vaccinated for the coronavirus ""cannot spread it to you."""
3612,pos,0,0,3,1,This whole segment on various subjects is horrifying  https://rumble.com/v184vq2-thomas-renz-pfizer-admits-never-manufactured-the-fda-approved-vaccine-chine.html,"""Pfizer admits there's no vaccine approved by FDA."""
3732,pos,0,0,3,0,https://rumble.com/vnlwi9-sources-vaxxed-delta-pilot-dies-in-flight-emergency-landing-required.html?mref=6zof&mc=dgip3&utm_source=newsletter&utm_medium=email&utm_campaign=Stew+Peters+Show&ep=2 Delta pilot dies in flight,"""Vaxxed Delta pilot dies in-flight, emergency landing required."""
3841,neg,3,0,0,0,"#ICYMI: The full approval for BNT162b2 (Comirnaty; Pfizer/BioNTech) will afford physicians greater prescribing capability and is expected to play a role in driving workplace #VaccineMandates.
https://www.neurologylive.com/view/fda-approves-pfizer-biontech-covid-19-vaccine-comirnaty?utm_source=hootsuite&utm_medium=twitter&utm_campaign=amplify","""There is no FDA approval for the Pfizer BioNTech vaccine for COVID-19."""
3842,pos,0,0,3,0,RED ALERT: Covid internment camps announced in America; Tennessee governor signs EO authorizing National Guard to carry out covid medical kidnappings - Daily News Break https://dailynewsbreak.org/red-alert-covid-internment-camps-announced-in-america-tennessee-governor-signs-eo-authorizing-national-guard-to-carry-out-covid-medical-kidnappings/,"""COVID internment camps announced in America: Tennessee governor signs EO authorizing National Guard to carry out COVID medical kidnappings."""
3902,dif,0,0,0,3,"A @CUBoulder-led study on the 50-year-old ""marshmallow test"" found that a fresh, multicultural approach to the test adds a missing piece of the story: What kids are willing to wait for depends largely on their cultural upbringing. https://www.colorado.edu/today/2022/07/21/new-take-marshmallow-test-when-it-comes-resisting-temptation-childs-cultural-upbringing","There are 500,000 ""missing kids a year."""
3911,neu,0,3,0,0,"""We are seeing an unprecedented number of kids being lured or groomed,"" says Stephen Sauer with Cybertip. https://globalnews.ca/news/8965725/advocates-stress-app-awareness-after-missing-13-year-old-edmonton-found-alive-in-u-s/?utm_source=%40GlobalEdmonton&utm_medium=Twitter #ICE #EPS #ALERT #Oregon","There are 500,000 ""missing kids a year."""
3912,dif,0,0,0,3,Iii8i8i8i8iiiddcxxe90 Day Fiance: Karine &amp; Paul's Kids Are Up For ADOPTION! 3-Year-Old Son Pierre MISSING For A Month? https://www.tvseasonspoilers.com/news/90-day-fiance-karine-pauls-kids-are-up-for-adoption-3-year-old-son-pierre-missing-for-a-month/,"There are 500,000 ""missing kids a year."""
3922,dif,0,1,0,3,"Really wish a could drive, kids are missing out on a holiday a booked last year!  and the train is bloody expensive","There are 500,000 ""missing kids a year."""
3940,dif,0,0,0,3,I hope &amp; pray we have a parade and carnival this year  our kids are missing out on quality fun..,"There are 500,000 ""missing kids a year."""
3941,dif,0,1,0,3,We are missing kids with #ocd.  A 17 year average for #diagnosis is pretty awful.  @IOCDF @NIMHgov @APA,"There are 500,000 ""missing kids a year."""
3961,dif,0,0,0,4,How did the pandemic impact homeless kids? Thousands are out of school - Deseret News https://www.deseret.com/2021/10/15/22728561/420000-homeless-kids-went-missing-from-schools-rolls-last-year-they-may-never-be-found via @GoogleNews #preK #literacy #COVID19  #GetVaccinated #mondaymotivation #mondaythoughts   #Autism  #school   #kids #stress #coronavirus #homeschooling #Halloween,"There are 500,000 ""missing kids a year."""
3971,pos,0,0,3,1,"Bowers testified that Trump &amp; Arizona Republicans pushed the legislature to decertify the 2020 presidential election results.

Respecting the democratic process should be the bare minimum for elected officials, but today's GOP will kick you out for it.
https://thehill.com/policy/national-security/3567185-arizona-gop-censures-rusty-bowers-after-jan-6-testimony/","Arizona ""could decertify"" the 2020 presidential election"
3982,neu,0,3,1,0,"Which state will be the first to #decertify 2020 presidential ""#election""?  #Arizona ?  #Wisconsin? #Pennsylvania? #georgia? Could get #interesting...","Arizona ""could decertify"" the 2020 presidential election"
4013,neg,3,0,0,0,"Sen. Ron Johnson is set to appear on a vaccine-focused call tonight with an org founded by Steve Kirsch, who has said Pfizer's vax kills more people than it saves and that COVID-19 vax killed twice as many kids as COVID itself, both untrue statements.

https://www.vacsafety.org/weekly-calls","""Pfizer vaccine kills more people than it saves."""
4021,neu,0,3,0,0,"https://www.whackd.dev/2021/09/leading-us-corona-researcher-pfizer.html Leading US Corona Researcher: ""Pfizer vaccine kills more people than it saves"" $WHACKD","""Pfizer vaccine kills more people than it saves."""
4061,neg,3,1,0,0,Yay for kids under 5 in the USA! FDA unanimously approved the Moderna 6mo-6 yrs and the Pfizer 6m-5yr #COVID19 vaccines   @TGAgovau when will we see your decision for Aus? You've had Moderna data since the 13th of May! https://www.tga.gov.au/news/media-releases/tga-commences-evaluation-moderna-covid-19-vaccine-spikevax-children-aged-6-months-5-years-old,"The Pfizer COVID-19 vaccine ""is not approved."""
4071,neg,3,0,0,1,"Here's an honest question for all of y'all!  When have we EVER heard of a ""vaccine"" not being approved?!?  https://www.usatoday.com/story/news/health/2022/05/17/fda-authorizes-pfizer-covid-19-vaccine-booster-children-5-11/9805917002/","The Pfizer COVID-19 vaccine ""is not approved."""
4073,neg,3,0,0,0,FDA approved booster for ages 5-11yrs. https://www.fda.gov/news-events/press-announcements/coronavirus-covid-19-update-fda-expands-eligibility-pfizer-biontech-covid-19-vaccine-booster-dose,"The Pfizer COVID-19 vaccine ""is not approved."""
4080,neg,3,0,0,0,Here's what you need to know about the recently extended emergency use authorization of the Pfizer-BioNTech and Moderna COVID-19 vaccines. https://www.mibluesperspectives.com/stories/for-you/second-covid-19-vaccine-booster-shot-approved-what-it-means-for-you?utm_source=TW-BCBSM&utm_medium=You&utm_campaign=COVID19,"The Pfizer COVID-19 vaccine ""is not approved."""
4081,dif,0,0,0,3,"Pfizer's #COVID19 #Vaccine With Comirnaty Label Still Not Available in US!

As predicted by all the pundits...they'll never sell #Comirnaty in the USA without immunity. They KNOW it's killing people.

https://www.theepochtimes.com/mkt_app/approved-version-of-pfizers-covid-19-vaccine-still-not-available-in-us_4046513.html","The Pfizer COVID-19 vaccine ""is not approved."""
4090,neu,0,3,0,1,"#HealthCanada approves #moderna technology for kids reports @CityCynthia but the big question &amp; the reason for the ongoing resistance or regret is, Is it #FDA approved beyond for emergency roll out? @GovCanHealth
   
https://www.fda.gov/emergency-preparedness-and-response/coronavirus-disease-2019-covid-19/pfizer-biontech-covid-19-vaccines https://www.fda.gov/emergency-preparedness-and-response/coronavirus-disease-2019-covid-19/pfizer-biontech-covid-19-vaccines","The Pfizer COVID-19 vaccine ""is not approved."""
4110,neu,0,3,0,0,First out// $BNTX: Australia&amp;#39;s TGA Says Pfizer&amp;#39;s COVID-19 Vaccine Provisionally Approved For Use As A Booster In Individuals Aged 16-17 Years Old; Continues To Monitor Ongoing Trials Associated With Booster Doses For Younger,"The Pfizer COVID-19 vaccine ""is not approved."""
4131,neg,3,1,0,0," Oxford-AstraZeneca
 COVID-19 
 Moderna
 Pfizer-BioNTech
Let me know if another vaccine is approved !","The Pfizer COVID-19 vaccine ""is not approved."""
4170,pos,0,0,3,0,"And still - 
Authorizing a product that this FDA has not approved! https://www.theepochtimes.com/mkt_breakingnews/fda-authorizes-moderna-pfizer-covid-19-vaccine-boosters-for-all-adults_4113551.html","The Pfizer COVID-19 vaccine ""is not approved."""
4172,neg,3,0,0,1,Pfizer vaccine approved for kids https://www.iheartradio.ca/am-1150/news/canada-authorizes-first-covid-19-vaccine-for-kids-1.16516546,"The Pfizer COVID-19 vaccine ""is not approved."""
4192,dif,0,0,0,3,"Will Oscar go: Hey Bert + Ernie are still surviving having Aids, I think I'll be fine. 
https://www.tmz.com/2021/11/06/big-bird-gets-covid-19-vaccine-sesame-street-pfizer-approved-kids/","The Pfizer COVID-19 vaccine ""is not approved."""
4212,neu,0,3,0,0,Breaking: CDC committee OKs Pfizer-BioNTech's COVID-19 vaccine for kids ages 5-11. https://www.usatoday.com/story/news/health/2021/11/02/covid-vaccine-kids-children-approved/6233927001/,"The Pfizer COVID-19 vaccine ""is not approved."""
4233,neg,3,0,0,0,JUST IN: The Pfizer booster has been approved for emergency use since late last month. &gt;&gt;&gt; https://www.kfvs12.com/2021/10/21/pfizer-covid-19-vaccine-booster-shows-high-effectiveness-companies-say/ https://www.kfvs12.com/2021/10/21/pfizer-covid-19-vaccine-booster-shows-high-effectiveness-companies-say/,"The Pfizer COVID-19 vaccine ""is not approved."""
4281,neg,3,0,0,0,"""Legally distinct"" Pfizer vs Comirnaty ""vaccine"" approved by @FDA. Howabout an FYI?
Comirnaty and Pfizer-BioNTech COVID-19 Vaccine https://www.fda.gov/emergency-preparedness-and-response/coronavirus-disease-2019-covid-19/pfizer-biontech-covid-19-vaccines","The Pfizer COVID-19 vaccine ""is not approved."""
4291,neu,0,3,0,0,Looks like a children's COVID vaccine may be on the horizon. https://thehill.com/homenews/sunday-talk-shows/569914-gottlieb-says-pfizer-covid-19-vaccine-could-be-approved-for/,"The Pfizer COVID-19 vaccine ""is not approved."""
4294,neg,3,0,0,0,"The first vaccine for the age group, Pfizer's, was approved for use in May.

https://www.mymuskokanow.com/113354/news/health-canada-approves-moderna-covid-19-vaccine-for-children-12-and-older/","The Pfizer COVID-19 vaccine ""is not approved."""
4322,dif,0,0,0,3,I convinced my vaccine-hesitant boyfriend to get the COVID-19 shot - here's how https://www.businessinsider.com/covid-19-vaccine-side-effects-fda-approved-hesitancy-moderna-pfizer-2021-8 (#Siguemeytesigo) (#Followback) (#News) (#SDV),"The Pfizer COVID-19 vaccine ""is not approved."""
4330,neg,3,0,0,0,"Hey y'all should get  a covid-19 vaccine.

""But they aren't FDA approved!""

*FDA approves Pfizer

Now will you get one?

""They approved it to soon!""

OH MY GOD WHAT WILL IT TAKE!?!","The Pfizer COVID-19 vaccine ""is not approved."""
4341,neg,3,0,0,0,Heads up! The Pfizer vaccine is officially FDA approved.  https://www.mix965tulsa.com/news/trending/coronavirus-fda-grants-full-approval-pfizer-biontech-covid-19-vaccine/Z4UOA6XNWFGHPK3IVLJVJM4YWU/,"The Pfizer COVID-19 vaccine ""is not approved."""
4362,neg,3,0,1,0,"Things that kill you in the USA:

0.0018% COVID-19
0.0003% attributed
0.0001118%
0.000003%  vs 
0.000002% Lightning
0.00000000905% J&amp;J ""blood clots""(just 3 people, we have treatments now)
0.00000000000% FDA Approved COVID-19 Pfizer&amp;BioNtech vaccine

Get the vaccine.","The Pfizer COVID-19 vaccine ""is not approved."""
4370,neu,1,3,0,0,"Uuummm...really?...$$ talks

Pfizer's Covid-19 shot fully approved by US regulator for use in over-16s https://www.rt.com/usa/532833-fda-pfizer-vaccine-covid-approval/","The Pfizer COVID-19 vaccine ""is not approved."""
4371,neg,3,0,0,0,"Cubs win! Cubs win! I mean, Pfizer is fully FDA approved! Pfizer is fully FDA approved! https://www.fda.gov/news-events/press-announcements/fda-approves-first-covid-19-vaccine?fbclid=IwAR01IwPgXbXLPJ2G72oNtgGCIu4Y1OCoJAgB--26S3SDuf_u7sbqNQ0dZo4","The Pfizer COVID-19 vaccine ""is not approved."""
4411,neg,3,0,0,0,"#Pfizer is now FDA APPROVED  

https://fox5sandiego.com/news/coronavirus/us-regulators-give-full-approval-to-pfizer-covid-19-vaccine/","The Pfizer COVID-19 vaccine ""is not approved."""
